"Lol you're really going to talk about racism? people talk about the US being racist cause we put our problems in the spotlight and actually attempt to fix them. Most other countries just accept things the way they are and dont even put up a fight for change,",neg
"So with this extra time, are they playing until 120 minutes or until someone scores?",neg
Did you? Who will be representing the region in the confederation s cup doh?,neg
I'd be thanking the Russians and Indians before you lot. Fucking hollywood cockheads,neg
We did it Reddit!,neg
Still shit on Fifa 16,neg
"Right, but Can's goal was far more important. Idk, I don't really care about announcers and their perceived biases but it is weird.",neg
Give him the 100K contract now,neg
"I have to go to work in an hour, can this not go to penalties?",neg
"anytime, sir",neg
,neg
ok fuck this ref seriously,neg
Yes they do. Giroud.,neg
That German girl!!!!!,neg
"Just wanna be apart of the comment thread when people look back on this in years time. Hi,future people, how did you end up here?",neg
THIS REF IS FUCKING SHIT. WHOS DICK DID HE SUCK TO GET THIS MATCH?!,neg
"To be fair, we here in the US aren't the only ones that call it 'soccer'.",neg
Man this is like this season equivalent to that goal Mata scored against Liverpool.,neg
[deleted],neg
People downvoting you but they know it's true. It's a nice fairytale story and all or whatever but it's not like they're suddenly gonna be champions of Europe now,neg
I don't think anyone can see this post.,neg
Doesn't get taken down for copyright. It works fine in Google Chrome (why would you use anything else?),neg
[removed],neg
Get the fuck up you pussy,neg
Well that was even better than Mkhitaryans,neg
they really could,neg
I hope Sunderland manage to name the stand after him. Little fighter can rest now.,neg
Deserves a statue at the SoL.,neg
Reddit collectively jizzes over an average looking German fan.,neg
show the intruder you bastards,neg
Didn't mean as the number one example but one of the 10-15 world class players In the league IMO,neg
#UEFALONA,neg
Tim Howard,neg
6/10,neg
[deleted],neg
"Hazard vs. Arsenal too, no?",neg
"**105':** Hot babe/bird shown, game is officially boring",neg
#DeutschlandberAlles,neg
Should've gone with Barca flair mate. ;),neg
I don't think they've quite 'saved football'.,neg
"Ref doing great so far, really stepping up to the plate. Muller finally getting caught out for his spoofing as well, should be booked for it",neg
"Huge USMNT fan, but that Sweden goal was better. One touch, farther out.",neg
/r/iamverysmart ^^^/s  edit: thought it could work given the drivel that sometimes get upvoted.,neg
Argentina flopping like crazy...,neg
"Have fun being ruled by them, I guess. It's not our fault you can't practice democracy.",neg
"it's hilarious that /r/football is just a shit version of /r/soccer when only 2 countries I know of use the term ""soccer"" instead of football, and neither usa or australia are considered to be anywhere near the best at the sport.",neg
"Because fuck you, that's why",neg
If you think that's a penalty you need to learn the fucking rules kids.,neg
not even stirring shit but Andys was objectively better,neg
"True, but basing that on a 20 seconds clip is a bit stupid don't you think? :')",neg
Blatant,neg
"You get downvoted in this subreddit if you say that bpl is a bad league, but everyone knows it is true. La liga dominates now 10 times more.",neg
How do you get 300 up votes for such a stupid comment? That's just not even true. They frequently say matter of fact shit.,neg
Comment from Youtube: 'Some barca players think the penalty box is a swimming pool',neg
"What an awesome game till the first half. They are literally playing the game of their life. Whoever wins today, this is going to be remembered for times to come.   Viva football.   Hoping that messi would score a blinder in the 88th minute to seal it.",neg
Red Card for Neuer,neg
That makes no sense. Without the goal PSG would be through. So ofcourse it matters. Yeah PSG played like shit but so did Barca last game.,neg
"Oh cmon! It's a fantastic goal, it's great he did in a match that wasn't a friendly and they badly needed not to lose.  But don't pretend it's the hardest trick in the book. Literally anyone that knows how to play soccer can do that. For professional players it's like nothing.  Again, he gets a lot of praise for doing it in that situation and everything, but the trick itself is one of the easiest things to do. There are a ton of goals like that one scored.",neg
_  TAKE MY ENERGY OZIL _,neg
"So who is this? A players kid?  Edit: I was actually curious. Post shoots /r/all and the top comment is about banning people with 0 context about this except for a twitter account saying this is about a kid with cancer.   Edit 2: Ah yes, asking simple questions brings on massive down votes. I love how Reddit hates it when people try to be informed on a topic.",neg
"I feel so sorry for Ludogorec. They put up a great fight, but zil crushed them in the end. I hope they go on to the Europa League.",neg
It's funny because the last two letters in Pogba's name are 'ba' and you can turn that into another word.,neg
"No european has the right to say ""Americans don't care about soccer"" ever again.   Joking aside, this is a great day for the sport we all love.",neg
Neymar MOTM great call from the referee fair penalty. PSG is shit.,neg
Haha new football fans calling for a red on that,neg
I didn't think America would save football,neg
Germany have won this either way. Argentina won't score in the next 15 minutes and having a penalty shootout is like giving the Germans a victory.,neg
"Best midfielder in the prem, possibly the world right there. He's really on another level.",neg
"Its to fucking much! What a game, what a shitty ref. Maybe not, but my emotions are fully rotating. I don't know what to feel.",neg
According to /r/worldnews this was all the US and no one else.,neg
Goal of the millennium,neg
No. If he's playing for and representing Switzerland he's fucking Swiss.,neg
[removed],neg
This,neg
"No England players turned up at all. Of course a gunners fan makes it about spurs though, when it isn't. I swear you're all more obsessed with us than you are with your own club.",neg
Iraq. You've liberated us enough thanks.,neg
STOP,neg
I've referreed U9 girls that play better than this,neg
I'd blame them if they don't.,neg
Ozil has not impressed this tournament. Showing that Arsenal DNA,neg
You should merge with r/football and use the correct name for the game.,neg
Don't see what Higuain is complaining about. I'd body collide with Neuer anytime ;),neg
"So let me get this right -  America does bad thing = Not in my name, I didn't vote for it.  America does good thing = FUCK YEAH WE'RE THE BEST COUNTRY EVER.  Selective memory much?  Oh yeah, nice casual racism too.",neg
What's the context of this? I think I'm missing something..  EDIT: I now know what happened. Wow :(,neg
"He will be shit the rest of the game, and the next 3-5 games, but then score Another screamer, repeat the cycle.",neg
[deleted],neg
"DEUTSCHLAND  DEUTSCHLAND, BER ALLES, BER ALLES IN DER WELT",neg
[removed],neg
TOLD YOU  http://www.reddit.com/r/soccer/comments/2alnzy/match_thread_germany_vs_argentina_2014_fifa_world/ciwgrrq,neg
zil completely surprised by that ball.,neg
Hes concused take him out....,neg
"The soccer (football, futbol) world combines. What a wonderful day",neg
"And now we're down to 5800. Yes, yes, let the Gooner hate flow through you all.",neg
&gt; Walker and Dier were fantastic.  They were at fault for the 2 goals we conceded? Walker lost his man for the first and Dier was standing ball watching for the second.,neg
[deleted],neg
Soccer,neg
Fucking ref is blind or biased,neg
It's a dive and the dirty cunt knows it because he starts grabbing his neck afterwards.  Fuck I hate him so much.,neg
"Neither Bale nor Ronnie have ever bitten anyone, but they're both diving cunts.",neg
This didn't really do a good job of answering either of OP's questions.,neg
That Bavarian cutie.,neg
"USA, USA, USA.  I propose a temporary ceasefire of abuse on the MLS for 2 days to celebrate the fact the Yanks have probably just finished Blatter.",neg
WE GET IT,neg
Young Korean talent?,neg
I hate that shit. Torres makes an amazing play to set up the goal and Gerrard runs around like he did it all just because he scored. Go find your teammate and thank him for the incredible set up.,neg
"Dear r/all,     This is the greatest footballing comeback of all time combined with the worst bottle since yesterday.",neg
Born in Barcalona?,neg
Thats too much tbf.. Lmao downvoted for saying donating 100% of your income is too much to ask for,neg
where's the straight red for the cunt aguero?,neg
[deleted],neg
"Jesus Christ, some of you cunts are unbearable.",neg
Only offside ones though,neg
i dont think you should be downvoted for being right  guess i caught all the downvotes instead lol,neg
"He is a terrible commentator, though. Boring cunt",neg
"Mexican here, I bet I can guess who you voted for... Sad!",neg
https://streamable.com/4o81p,neg
GOAT,neg
Finally its the u.s. turn to win the world cup.,neg
That amount of contact is never a penalty without the dive. And the contact with the knee is after suarez dives.,neg
HAHAHA BREXIT MEMES AMRITE GUISE ?,neg
"Who is he, and why is this on r/soccer?",neg
"Yep, Walker was fantastic at allowing Iceland to equalise.",neg
"Fuck, when will this whole ""Tyler just loves United"" idea die?   The reason he went nuts over the Martial goal and not Benteke's is because the former was huge in context.",neg
"I can't tell if you're being serious but yes it is always cheering for them. Largely because they're the largest fan base here by over 50% of the next highest team (Chelsea, who also hate us)",neg
I considered this game a win... Aka we didn't get beat as bad as Mexico,neg
those pussy argentinians only play on counter attack and dive non stop.also so much luck.  this ugly team is responsible for the 0-0 semi final and the other 1-0 games up to this final.such an ugly team shoulnd't be crowned the best in the world.,neg
By looking at things without bias for one second? Would I be allowed to acknowledge Aguero as one of the best players in the league or is that somehow blasphemous,neg
"Bruh, chill, I don't know whats more acceptable in this sub. I know it's /r/soccer but I've haven't been around this sub.",neg
Lol wut,neg
"Everyone has a ""closest team"". Just pointing that out.",neg
"Wait are you counting the Shawcross one? Or were there another two, missed most of the game.",neg
Neuer deserved a red or at least a yellow for that,neg
Am I the only one that thinks Ozil looks like a gerbil?,neg
Neuer can fuck out of this game. Such a dirty and cocky player,neg
bergkamp's goal was a total accident tho,neg
Half the German team will be limping by the end of the match.,neg
Si era penal!,neg
Only Watford winning the premier league or England winning the world cup could top this for me. Slightly disappointing that sport will probably never be this good again.,neg
"Alright, Schweinsteiger you win the cup for most falls in a single match, also known as the most grass-stained kit.   Edit: I love you anyway you beautiful man, you.",neg
Diving is not cool. It's against the spirit of the game. He's a cheating bitey cunt.,neg
Ronaldo wouldn't have missed that,neg
Can't expect it to be /r/football on a predominantly US website.,neg
A quality contributor in my Ultimate Team side. Scores some cracking longshots.,neg
[removed],neg
I suppose we just ignore the offside rule so long as the finish is good?,neg
The point still stands though,neg
"Suprisingly, those teams end up being Barcelona, Bayern or Arsenal rather than Crawley Town, FC Gueugnon or Chacarita Juniors",neg
"Manchester United's top goal scorer - Mr Wayne Rooney from Croxteth, Liverpool.",neg
Higuan just over reacting... Neuer did great,neg
May you shit your pants in your sleep.,neg
[My proposal.](http://i1.kym-cdn.com/entries/icons/original/000/016/212/manning.png),neg
Goatse wins the World Cup for Germany.,neg
Thank fucking god.  All the anti-trump shit is making me root for him. I'm just so sick of it all.,neg
[deleted],neg
http://media4.giphy.com/media/SYoZuWvdqWRlC/giphy.gif,neg
imo ronaldo comes close,neg
,neg
a fucking 22 year old kid scores the game winner in extra time in the world cup final,neg
I guess the English team misunderstood the brexit referendum.,neg
Poland won the match!,neg
"I'm shocked to see Barca fans in amongst the home crowd?   this rivalry isn't as fierce as I thought  I wouldn't like to see that at one of our derbies  (edit :because of the trouble it would cause, full of bedwetters on here)",neg
I thought it was pretty obvious but apparently not.,neg
[deleted],neg
From the states. Can I get an ELI5 please?,neg
"These Argentinian away kits really don't look nice, they look more like training kits.",neg
"Great tackles, Boateng really doing well.  Sorry to see Klose coming off the pitch, mad respect for all his work through the years.   Will Gtze be the change that Germany needs to score?",neg
above average goal,neg
I feel ozil was better when he was with RM.,neg
They still lost,neg
"Reactions across the football world:  Michael Owen: At this level if you are doing bribes then this is the sort of thing you should expect at this level. He needs to be more legal and less bribed. Its all about those small details when your at the very top.  Andy Gray: GET IN THEIR MY SON YOU BEAUTYYYYYYYYY  Jamie Carragher: Thi sweek will be toff for the whole of futball i believe. A believ tha firmly Jeff.  Jamie Redknapp: What people don't realise is - how good this little guy actually is.......I don't mean to go off topic again Jeff, but as Carra said - this sort of bribery needs to be stamped out.  Gary Neville: Sorry Redknapp is off again on incoherent bullshit. Take this mic of me.  Michael Owen: As much as i have to disagree with everything that has just been said, i do agree with it to a certain extent.  Middle Eastern Commentary: GOLGOL GOL GOL GOL GOL GOOOOOOOOOOOOOOOOOOOOOOOOOOOOOOOOOOOL GOALLLLLLLLLLLLLLLLLL GOLGOL GOL GOL GOL GOL GOOOOOOOOOOOOOOOOOOOOOOOOOOOOOOOOOOOL GOALLLLLLLLLLLLLLLLLL GOLGOL GOL GOL GOL GOL GOOOOOOOOOOOOOOOOOOOOOOOOOOOOOOOOOOOL GOALLLLLLLLLLLLLLLLLL GOLGOL GOL GOL GOL GOL GOOOOOOOOOOOOOOOOOOOOOOOOOOOOOOOOOOOL GOALLLLLLLLLLLLLLLLLL GOLGOL GOL GOL GOL GOL GOOOOOOOOOOOOOOOOOOOOOOOOOOOOOOOOOOOL GOALLLLLLLLLLLLLLLLLL",neg
What the fuck was Garay thinking? Such an unecessary use of force.,neg
"Mkhitaryan's was a better finish, curled it far post and the keeper had absolutely no chance.",neg
NFL is only a 6 months sport yet it's only a thousand less. Shame.,neg
My jimmys are thoroughly rustled..........kind of hard to breath.........kind of erect :),neg
"That's what Google is for, chum",neg
"[Hands on your hearts, boys.](https://www.youtube.com/watch?v=Vmc-pEyUHTs)",neg
Kosovo,neg
INSIDE,neg
[deleted],neg
"he punches, he whines, he throws tantrums, he elbows and he will retire and end his career in the shadow of Messi. Swallow that.",neg
"Genuinely happy for him. But honestly has it not been frustrating watching him lately. He's a shadow of his former self and I don't think playing him deeper or on the wing is a good choice when there are players with that as their natural position.   How much time do you guys think he has left at Man U. Now that he has this amazing achievement I would really like to see him move back to Everton or take a new challenge. Like I said, I think Man U is just a cut above what he's capable of.. besides his rare moments of brilliance of course.",neg
[deleted],neg
"Thank goodness, we have forced him out of office!   The good ole' USA flexing it's legal reach over borders and global organizations",neg
Riding the train with you buddy,neg
"Sure?  This is the best player in HandEgg: [Brady](http://cdn28.us1.fansshare.com/photograph/tombrady/tom-brady-goes-shirtless-for-costa-rica-beach-stroll-body-2013261181.jpg)  This is the best player in Real Football: [Cristiano Ronaldo](http://www.corazonblanco.com/media/galeria/44/8/8/2/3/n_real_madrid_cristiano_ronaldo-843288.jpg)  Your best player doesn't even look like an athlete.  It's called Football because Americans are retard, the rest of the world calls that boring sport HandEgg, which makes sense.",neg
[deleted],neg
Fuck her right in the pussy   --America,neg
"If you downvote this guy, Americans won't get the joke.",neg
"GOOD JOB REDDIT, WE DID IT!! :)",neg
"I'm not a soccer (or football, whatever) guy, so forgive me, but...what is significant about this? I'm assuming there's a reason this goal made the front page.",neg
"Here from /r/all, can someone explain what happened in this match? Is it considered an upset or choke?  Edit: lmfao downvoted for asking a question you queers are something else",neg
So many world cup refs have absolutely ZERO balls.,neg
Can disagrees.,neg
Goalie was a baws. What else was he supposed to do? Let him score a goal?,neg
"This is the Superbowl of Soccer, I guess.  There's no national equivalent so I can't compare the World Cup.",neg
Penalty and a red card. It doesn't matter that he got the ball. That's as dangerous a challenge as you'll ever see.,neg
How is that not a red card for Neuer?!,neg
[deleted],neg
Now you made me go back and upvote them. Oh well.,neg
At least this attitude isn't accompanied by poor brown people being bombed to death this time. That's a big improvement.,neg
I don't think he meant to do that   Edit: did this really need an /s? I'm referencing everyone after his goal for stoke that everyone said was a fluke,neg
"You can't say that in here, there are a lot of nice European folks here who don't take kindly to that kind of talk",neg
/r/thathappened,neg
so can people stop saying messi is the greatest player in the world? dude is a choke artist.,neg
"Cry argentinians, cry !",neg
[deleted],neg
Messi you're still a legend and the best player on this planet,neg
Giroud is goal of the decade so far. It was a flipping scorpion kick from the edge of the box.,neg
hello /r/soccer!!  after this game i'll see you in 4 years!  i'll miss you though.,neg
No it's a disease,neg
[deleted],neg
This one is better coz its onside.,neg
Uefalona,neg
BIGGEST CHOKE OF THE TOURNAMENT AFTER SUAREZ CHOKED GIORGIO'S THROAT WITH A JUICY BITE,neg
He hates seeing us do well.  He's gonna hate his future.,neg
"PSG didnt blow it, the UEFA gave Barca 2 pens without a blink of an eye and 7mins of extra time, which ended immediately after their 6th goal.",neg
Chill out.,neg
"Germany get one yellow after the other, argentina so far lucky...",neg
And he's onside,neg
Nope. That was an amazing goal. It's like Robin's header or Zlatan's bicycle kick. It's just a unique goal you'll probably never see again.,neg
Belgium's best performers so far aren't spurs players.,neg
Made it to the top of r/all!,neg
you mean the greatest suarez dive?,neg
/r/retiredgif,neg
Better than Zidane's v Leverkusen,neg
Imagine being so pathetic that you'll try and be edgy about a child's death for internet points,neg
Exact same reaction,neg
Commenting in an epic thread.,neg
Who cheated,neg
"Not to mention scored Benteke scored an insane overhead kick and of course, it only elicited a tepid response from Tyler.",neg
[deleted],neg
He's still shite,neg
boo hoo :(,neg
[deleted],neg
Atta boy Neuer!!!! fuckin rights bud,neg
[deleted],neg
England the only country to leave Europe twice in one week.,neg
So sad... 45-75 minutes more then almost 50 days til American football comes back. It will be a sad month and a half. Stupid baseball why can't you not suck?,neg
"Man, this hits Manchester United players and fans hard...",neg
"*When you walk through a storm...*  Rest in peace, Bradley.",neg
This is 'Murica mothafucka. Justice doesn't sleep,neg
"Seriously, has any of you EVER seen a ref who seemed biased against Germany?",neg
A world cup and a title with a mediocre team,neg
Schweinsteiger on the ground again. What a joke.,neg
Lol fuck you,neg
"His eyes are offside, his eyes are offsiiiide! Mesut zil his eyes are offside.",neg
Fist punches seem to be allowed now.,neg
[deleted],neg
"""USA MOTHERFUCKER""    &gt;Arsenal flair    USA &amp; ENGLAND MOTHERFUCKER BECAUSE FUCK SUPPORTING THE CLUB FROM MY CITY/STATE",neg
"That's the wildest tackle I've seen in a while. ""He got his head and his neck in the way of the goalie"", apparently.. sheesh.",neg
"We were specifically talking about how he loves narratives and you were comparing the Martial goal to the Benteke one. I merely pointed out that the narratives were not the same, there's no need for the sarcasm mate.",neg
"Their national team does, but their league doesn't. American League soccer is crap, although not quite as crap as my country's (Australia).",neg
NANANA! GOAT CHEESE YOU BEAUT,neg
Payet-esque,neg
RIP......,neg
wow get up asshole,neg
Rooney plays for Man United though which clearly helps,neg
Real Madrid makes me want to kill myself,neg
I'm not sure why we expected a team wearing the crest of the Three Lions not to bottle it.,neg
This is so fucking cringey. You two brown nose fuck nuggets need to get a room.,neg
Most despicable player in the world,neg
USA's reasons for doing this are Putin and Russia 2018.,neg
"Hey england, if you want to stop being shit at soccer then unite your teams. Combine NI, Wales, Scotland, and England and you'll have a world class team instead of the shit you bring up each year.",neg
[deleted],neg
Lol masch really letting Schweinsteiger know who runs midfield there,neg
Why the fuck are you belaboring this?,neg
Even the wall couldn't have stopped that!,neg
"Harald Schumacher esque challenge from Neuer, that was a foul. Penalty even, I think it was in the box",neg
They voted LEAVE again..,neg
HENRIKH MKHITARYAN EAT YOUR HEART OUT,neg
Why does it matter?,neg
I want to argue with you but I can definitely see where you're coming from. We're an excitable people..,neg
Hahahahahah the fact that this got downvoted further proves my point. They still are acting better,neg
It's amazing how winning the league makes you forget about Vardy being a massive racist.,neg
Michael Bradley gonna make Mexico pay for the wall,neg
The ref was a disgrace.,neg
How bought was this match though,neg
He's absolutely been playing badly.,neg
"He's been our best player for years, I'll never understand the people who attack him.",neg
[deleted],neg
"AHAHAHAHA WHAT A JOKE MESSI GETS THE GOLDEN BALL     ahahahahah     oh man thats almost sad.   fucking did nothing of value in the knockout stages if you compare it to other players     MORON FIFA    Even Neuer deserved it more than Messi, no one can deny that",neg
"Ian Rush is top scorer for Wales, and for the country's most successful club (if you count trophies won) but he isn't knighted.   I'm not saying Ian Rush deserves to be knighted, being a great footballer doesn't mean that you should be knighted, there are quite a few good footballers. People like Alf Ramsay and Bobby Moore probably deserve it because England won the world cup (although Moore never got one) but giving knighthoods to people good at football, even management is just a bit silly and there is no reason why Rooney deserves knighthood over some other players. Although that hasn't stopped them before.",neg
Have a guy arguing with me telling me its ball to hand. Yeah why not just not have the bloody hand ball rule then,neg
Prob. not what's gonna be the end of him at this rate.,neg
"Wow, Argentina is losing a lot of respect from me here.",neg
NEVER THOUGHT I'D SAY THIS BUT THANK FUCK FOR CHELSEA.,neg
Keep going.,neg
"Looks like he can *puts on sunglasses* ...   score whenever, whereever",neg
Who is Bradley?,neg
[deleted],neg
"It's called a joke, people need to quit being such pussies about a joke..",neg
can someone explain this to me? I'm reading the comments and don't really know what's going on. The only thing I can comprehend is that Barcelona scored a goal.,neg
"whole planet calls it by its name, its also a name fitting to a sport, something you can't say about handegg",neg
"That should just not be a foul at all. The hit was hard, but the goalie has the right to go for the ball there. Higuain had no business going for it, but that isn't something which should get a foul called as he's perfectly within his rights to try to head the ball.",neg
[deleted],neg
I guess you could say... This is a klose game..:,neg
"This was the final I predicted in my WC bracket. I put my money on Deutschland, so why is my heart rooting for Argentina? So conflicted!",neg
As a newer football fan what's up with the stripes of different grass on the pitch?,neg
"To be fair, it's fucking hilarious (until we get beaten by iceland in the quarter)",neg
Because football is better than eggball,neg
"You're on an American website populated by mostly Americans talking about an amazing and long awaited thing that American authorities actually had the balls to try.   Jesus, let us have a little fun will ya?",neg
I nearly* questionably called it [38 minutes ago](http://www.reddit.com/r/soccer/comments/2alnzy/match_thread_germany_vs_argentina_2014_fifa_world/ciwgt2l). Gtze you beautiful beautiful man thank you!,neg
More head injuries than an American football game!!,neg
[deleted],neg
John Oliver better come through with his promises.,neg
https://streamable.com/0qrg  https://streamable.com/4u8i  https://gfycat.com/HeartyBowedAyeaye   imo all 3 of these Payet ones from this season are better. And if you go back further there's plenty better than this Messi one. I even think his one against Sevilla earlier in the season was better,neg
"Thomas Muller dives as much as anyone in the world, yet people here crucify South Americans for it, but Muller is the goddamn golden boy around here.",neg
[deleted],neg
Fucking filthy.,neg
[removed],neg
