"""Beckham...... Into Sheringham..... AND SOLSKJAER HAS WON IT!""",neg
[deleted],neg
[deleted],neg
"Sorry, I'm here from /r/all, what exactly happened?",neg
"lol wut? I'd hate it if you were my professor   **who this kid**   &gt; Unfortunately had cancer   **why it's on this sub**  &gt; He came into the football world frequently last season   &gt; Even though it is ""off topic"" going strictly on our ruling it's here because he's been frequently in the footballing world over the past season, this news is posted in sports sections of papers, BBC etc.",neg
"I think he meant a punt as in didn't expect it to go in, still took the shot &amp; intended for it to go goal bound so I personally don't use that as an indicator for which goal is better.    Cisse's is clearly better IMO, by a good margin.",neg
Britain's biggest upset since the American Revolution.,neg
Goatse WTF!,neg
United fans are not happy,neg
I don't,neg
This thread perfectly sums up why Americans on this sub are insufferable.,neg
[deleted],neg
The craziest goal of the past 10 years; simply stunning.,neg
Goal of the century,neg
"You're welcome.  Sincerely,   America.",neg
[deleted],neg
"Fuck, FIFA, why aren't you showing this to us!!",neg
"US with their first significant soccer accomplishment. We may not be the best at putting the ball in the back of the net, but man can we oust a dictator.",neg
Messi and he will seen as neck and neck. The debate will go on forever.,neg
USA&gt; Mexico.  Fuck Donald trump,neg
To think that Blatter did (almost) 5 terms just to get John Oliver drink a Bud Light.. Long con.,neg
To you. I enjoyed this thread a lot.,neg
Well done USA.,neg
We don't see you Limey bastards doing anything about this so suck it! WOO!,neg
UR GOING HOME LADS,neg
"SUCK IT, MEXICO!",neg
Should be a yellow for Shrrle,neg
[Vitaly invading pitch] (https://www.youtube.com/watch?v=iXPrioj0pqI),neg
"Wow, I am loving this game so far!! I seriously want this game to go to overtime and want Argentina to win! AHHHHH!!",neg
[Remember...](http://imgur.com/a/Wn03B),neg
"He dives just as much, throws hissyfits resulting in punching and kicking players, is a smug cunt, a massive diva and so on. Yes he is.",neg
Hated may be too strong of a word but definitely from a Liverpool supporter's perspective every one was definitely willing him to fail and when he did fail hard and for so long he was pretty much the running joke of the league. I wouldn't know about Chelsea fans but generally speaking can't help but have a poor opinion of them anyways with how they treated Rafa so I could only imagine how much their support or lack thereof meant to Torres. Sorry if you're a Chelsea supporter. Full-on bias here admitted.,neg
Europeans are salty about America comments because their countries didn't have the balls to do anything.,neg
"rubbish. credit where its due. its ridiculous that europe, the so called powerhouse of the game, could not clean its own house. they all need to go to jail, thats the only thing thats important now.",neg
And Manchester United are set to overtake Arsenal as the [biggest club flair](/r/soccerbot/wiki/stats) in the not too distant future.  What would /r/soccer think about that?,neg
Amazing job by the ref. Should receive man of the match,neg
Imho nothing supersedes that final and no referee help either.,neg
I'm just happy that Argentina hasn't won. Gratz Germany.,neg
"Don't start this, please ((:",neg
2006: Zidane headbutt to Materazzi. Zidane ejected.   2010: De Jong kung fu kick to Alonso's chest. De Jong gets away with a yellow.   2014: Neuer UFC knee to Higuain's face. Foul called on Higuain.   I'm scared for 2018.,neg
Or maybe people are excited that someone is finally doing something about these corrupt dickheads.,neg
Wtf this isn't rocket league.,neg
[deleted],neg
"zil pls.  Also, I need to go puke so someone please score before I go.",neg
"Which is also why I said ""usually"".",neg
So maybe now England will stop acting like they're the best in the world and favorites to win any tournament they compete in?,neg
Haha Spurs be cunts eat shit,neg
I don't understand how being 6-1 is a comeback.,neg
"People will yell about this being better than Mkhi's, I don't see why either has to be better. Both took incredible skill.",neg
"As usual, bunch of twats. Scummiest top club in Europe.",neg
Hoewedes foul wasn't a red. It wasn't on purpose. Just put the wrong leg up.,neg
"That's not because he's not worth it but because of the style they play there. There are many formations in which he could be a starter. I picture a 5 player attack with Alexis and Neymar as Wingers, Messi and Iniesta behind Surez playing as a striker. Busquets as the only defencive midfielder, the rest is obvious. Try and stop that.",neg
Should've given us 2022,neg
One day after Brexit... Coincidence? I think not!,neg
I just wanted to write something that wasn't 'holy motherfucking shit what a goal' which is what I said out loud and what everyone else wrote.,neg
Both of them...,neg
"*insert brexit joke*  OK guys, I'm ready for my first gold",neg
Mkhitaryan esque,neg
Fucked up ref on the opening match  Fucked up ref on the final match  What a great tournament,neg
"thats the best free kick the ""best player"" in the world can take? choke much?",neg
BYE BYE JUVE....wow,neg
"Even if you win everything there is to win on this Earth, you will always be a level below us after this game... Edit: I mean after this celebration ;)",neg
"Why isn't anyone talking about Suarez diving to get the penalty? He should be banned from the sport by now, towards the end Suarez and Neymar just trew themselves everywhere in desperation. How can you even celebrate this stinking match, go ahead and watch the replay of Suarez penalty...",neg
Neuer is a fucking rocket.,neg
lol can't even take a joke. If the team was full of arsenal players and played like this I would've posted the exact comment. Get off your high horse lmao,neg
"I was doing some studying for medical school, I almost looked away. ""Nah, nothing will come of this bouncing around the box shit - WHAT JUST HAPPENED.""",neg
[removed],neg
*offsides,neg
"I don't want to over exaggerate, but we basically won the world cup",neg
get absolutely fucked mkhitaryan you offside scrub,neg
"Fine, take your fucking upvote.",neg
But that 1 penalty mattered.,neg
[deleted],neg
But he has no food,neg
the real madrid oezil,neg
"still messi is better and nicer player   also ur argument is retarded, we r talking abt suarez and Ronaldo bot cheating cunts",neg
Sweinstaeiger is such a flopping piece of shit,neg
"It's absolutely sickening, and it upsets me that we even need to have this discussion on what should just be a page of condolences       RIP Bradley",neg
The thing about Arsenal is they always try to walk it in,neg
Be joking,neg
The greatest contribution the USA has made to football in a long time.,neg
England National teams are always a joke.,neg
Funny how silent the US fans are now after breaking their caps lock buttons in the days leading up to the game.,neg
"Sorry to tell you fella, but the 2016 goes to Arsenal aswell. (Ozil's beauty vs Ludogoret)",neg
Guzan is trash,neg
"Even if they cheated, they CHEATED THEMSELVES OVER A FOUR GOAL DEFICIT. I mean, even playing dirty, that's fucking impressive.",neg
Dirty.,neg
"If Germany wins, multiple sleeper cells in America will activate, and obama will turn into hitler.",neg
[deleted],neg
#MESSI,neg
About time FIFA got some Freedom.,neg
You're totally right fuck the downvotes I'm tired of the hate America circlejerk when their own national team can't get their shit together against Iceland.  And the worst part was that I was rooting for England,neg
WE LOST BY THE SAME MARGIN TO GERMANY AS ARGENTINA  USA USA USA USA USA,neg
More like Bale when playing for Tottenham.  https://www.youtube.com/watch?v=WxGaFP77gFA  It's damn near identical.,neg
[deleted],neg
Yes bois,neg
Payback for Kramer i guess,neg
fuck that diver,neg
The ref's been really good so far,neg
"apologies for bad english  where were you when england got kicked out from Euro 2016?  i was at home eating lecs when roy rang  ""englend is exit""  ""no""",neg
Just saw the video on BBC - what a touching and inspirational story.   I cried -,neg
I'd like to throw Matic's rocket from the other week in the mix as well.  Those long-range screamers get my shit rigid,neg
That's the best free kick goal i've ever seen.,neg
Fucking Higuain gets up to see the call then  falls down again... what a joke,neg
Goal for Germany at 74 or 77 mins. You heard it here first.,neg
[deleted],neg
"zil,  OPEN YOUR EYES!!",neg
"I really liked that Ramos dive because he sent off Cuadrado, one of the worst divers in Football.",neg
Classic Ozil,neg
[removed],neg
"Holy fucking shit, who the fuck thought Mhkis goal would be bettered!? Incredible!",neg
Hello r/all,neg
Lol Reddit could you be more biased? Germany is quite FUcking scared...   EDIT: hah autocorrect.,neg
Another big game where Messi gets hyped up and then does absolutely fuck all.,neg
Best goal of 2017 so far.,neg
Damn it feels good being English,neg
wait they actually played their last game already? oh well congrats to them still,neg
[deleted],neg
"Look, it'a an e-sport. A 100% classified sport.  Monopoly has no physical ability involved in it.  I mean you could argue speed cooking could be a sport, but actual cooking can't be because you being physically better than someone (within an obvious spectrum) doesn't actually help you.",neg
"Well... Football (real football, not that armored rugby) is the most popular sport in the world, so this subreddit should be the biggest one  by default",neg
get fucked piece of shit!! get absolutely fucked,neg
It's pretty much how they used to do their penalty shootouts.  No wonder he scored.,neg
can someone explain to me why the goal didn't count? thanks,neg
[deleted],neg
My tax dollars helped pay for this :),neg
No fucking way Messi should be best player of the WC.,neg
Take that kramer! You racist...,neg
2018- Russia  2022- Australia,neg
"Well if you can't understand the concept of something being harder to do vs a world class team, vs achieving it against a team such as Watford, I can't help that level of stupid.",neg
Offside    Edit: lol riled up /r/reddevils,neg
That's concussion worth for fuck sake and Germany get the free?!,neg
what a fucking legend! wish i had the balls to do this,neg
6-1 is a comeback?,neg
DANG JOHN OLIVER IS DA MAN,neg
"That doesn't make it any less of a joke, Suarez was already playing on a yellow for simulation and this was more of the same. It's a big problem, regardless of whether or not it's commonplace or good strategy. Neymar and Suarez were doing it all game and it certainly paid dividends for the team, which is exactly why people are outraged. Maybe PSG needs to get their shit together and not allow so many goals, but those two penalties were the total difference in the game and both were won by players that spent the entire match flopping around.",neg
The pitch invader was Vitaly Zdorovetskiy. He does pranks on Youtube. https://twitter.com/Vitalyzdtv,neg
"Hey guys, I wanted to contribute and maybe get some karma too. I's like that, it makes my wee wee hard. Harder than money makes Blatter his wee wee does.",neg
This over-the-top Murica circlejerk is a bit ridiculous isn't it?,neg
This is so fucking cringe,neg
Fuck. I had no idea who this little guy was and now that I know someone started cutting onions in the room. Shit is tragic.,neg
Get off Ronaldo's dick and come back whem reaches World Cup final!,neg
Shhh haha let me talk shit,neg
Shout-out to /u/FarAwayCows for welcoming all the Americans from /r/all.,neg
"It's not the best league, but you can say it's the most unpredictable.",neg
"who cares where someone is from? the more people watching, and on this sub, the better",neg
Ronaldo 0 for 36 in freekicks for his country lel,neg
[deleted],neg
Why is this being consistently downvoted? I can understand Spurs being sour but come on!,neg
That's just wrong.   You signed carroll and suarez as replacements for Torres when he left for chelsea. You got 50 mil for torres and spent it on the other 2.  Suarez came to liverpool on the same window but after torres left for chelsea.  Edit: Sorry I'm an idiot as everyone pointed out. Apologies.,neg
Damn that was dirty.,neg
What?,neg
12/10 with rice,neg
Maradona 1990 would have scored that,neg
I think it's funny,neg
[deleted],neg
[removed],neg
The Spurs contingent was well and truly shit.,neg
"His positioning was wank, mate.",neg
"Yeah, you guys should probably grow a pair and fight ISIS.",neg
Hello to everyone who's been talking shit the past few weeks.,neg
Those German submarines sure can dive.,neg
&gt; blew,neg
psg fucking lost 6 - 1. The ref doesn't hand out a 6-1 win.,neg
HEY. ARGENTINIANS. IF KRAMER GETTING HIT WASN'T A FOUL THEN YOU GO CAN GO FUCK YOURSELVES AND GET HIGUAIN OFF THE THE GROUND.,neg
Pepe is the biggest cunt of all time but why Ramos?? Genuinely curious...,neg
That can't be a healthy relationship.,neg
"I'm guessing they want this bc the club gets more revenue by being in the top league. The issue though is that if they are exempt and end the season in one of the relegation slots, a team above them will get relegated instead, which will piss them off (for a good reason too). If this occurs, you also have to worry about the quality of the league diminishing due to keeping a team that shouldn't be there.   I think it's great that other teams and groups are trying to help and support this team during a time of tragedy, but these are some implications that I hadn't seen anyone else talk about yet.",neg
Did Arsenal finally manage to walk it in?,neg
You jump in there in after 92 mins and try to stop a freak like Messi then mate. We'll see how that works out for you.,neg
I'm in the car driving are they in extra time or PK?,neg
La liga :  barca or Madrid (every year)  bundesliga : Bayern (every year)  English premier leauge : Leicester  You can't tell me that this leauge isn't the best in the world,neg
Sit the fuck down Mkhi,neg
thank you,neg
[deleted],neg
God help the rest of the world if the Americans ever turn their attention to soccer as a serious sport. It'd be like the eye of Sauron.,neg
Reminded me of Rakitic's goal against Juventus in the champions league final circa 2015,neg
"Kinda torn, but I think Cech, Oblak, De Gea, Neuer, etc, Are saving that more often than not.",neg
I wish i had more accounts to give you.....   MORE LIKES!?!!?!?!?!,neg
This kind of goal only happens because of a bad pass.  Discuss.,neg
[deleted],neg
what the fuck is with Barca and clutch goals this season,neg
Germany probably wins and Messi gets shown to be the choke artist he is. Perfect result.,neg
"Murica, Fuck yeah!!!",neg
God I hate Muller so much,neg
could have been worse. I'm sure Martin Tyler would have has less emotion than that,neg
[deleted],neg
Uefalona takes it again.,neg
"I like Neuer, but that shit is NOT COOL. Should've been a red!",neg
[deleted],neg
"I have the same feeling bro, it's just unbelievable to me how a person can be so heartless, it's just pathetic.",neg
"Haha exactly my train of thought. Seen some distinctly average yank goals on the front page but fair one, this one's brilliant.",neg
Higuain lost the match.,neg
WHAT THE FUCK REF  WHAT THE FUCK,neg
GOAT,neg
Are the Argentinians going to just camp on their half for the next 20 minutes?,neg
"I'm mad that Wondo can get within 10 feet of the pitch at an international tournament. Like, take him for moral support, but he's really not international quality like he was 2 years ago. (And was he *really* back then?)",neg
[removed],neg
"To the people from the frontpage, who came here without any idea what is going on:  This  thread is about football. Not your american football, but the *real* football. This was the second leg of the Round of 16 between Paris Saint German and FC Barcelona in the Champions League. In the first leg Paris won 4-0 and beat the favorites by a huge margin.   There is a special rule about away goals in Football cups like the Champions League. If both legs end with the same goal difference - e g. 2:0 and 1:3, then the team with more away goals reaches the next round. This was the case in the second leg. Paris scored the important away goal, so a 5:1 for Barcelona wouldn't be enough to qualify for the quarter finals. So they needed 6 (!) goals, which was more or less impossible.  In the 88th minute the score was 3:1. So there were only 2 minutes left + 5 minutes of injury time. Barcelona managed to do the impossible and score 3 goals in the last minutes. This video is the last goal in the 90+5th minute of the game, literally the last chance of the match. This match is comparable with the last super bowl match with the Patriots. Unbelievable.",neg
"Fuck the Aubameyang, can we have this guy please?",neg
"So they did the same thing in two different games, only difference is Barca managed to cheat and steal a penalty that got them through in this one. You can tip toe around it if you want, but what your argue in your first comment doesn't make sense.",neg
Oh god it feels so deliciously sweet. Eat your fucking heart out Mkhi,neg
Walt disney wouldnt have came with a script like this story! congrats to the foxes #foreverFearless,neg
"Well, this is were i stop watching football, **IF YOU CAN CALL THAT A RED ON THE FINAL OF THE CHAPIONS THEN WHAT IS LEFT FOR THE REST?**",neg
THAT WAS A FUCKING RED FOR FUCK'S SAKE,neg
"My memory of Boa Morte is only his time with Fulham, especially in the championship. Was he really good enough to be mentioned in the same sentence of those other players?",neg
INSIDE,neg
Mexico in the quarters against Chile &lt; US in the semis against Argentina,neg
"Way to make this about the Mls, per usual.",neg
"I installed the ESPN app about a year or so ago and decided to randomly pick an EPL team to support.  I landed on the Foxes because of reasons I don't remember now.  (I also picked Juventus, Celta Vigo, FC Cologne, Lorient, and the Pumas UNAM from Liga MX).  I had no clue what I was doing.  In the time since, I've learned about the EPL, had a rollercoaster ride with the Foxes (and Juventus), and learned a ton about soccer.  Thanks for the ride.",neg
Fuck yeah U.S.A bringing down the house,neg
Ukraine should have had at least 3. This was a long time coming unfortunately.,neg
"Brexit Friday, *Exit Monday.*",neg
"well, time to drink Argentinian tears now",neg
The english league used to be such a shit show in the 90's lol,neg
"Its not mexicos defense now, relax.",neg
Oh the risk didn't pay off,neg
[deleted],neg
Let's not get ahead of ourselves...,neg
"Was taking a pee, what is this talk of a cute german girl",neg
I guess someone can't ask a question without getting super amounts of hate. Sorry trying to be informed.,neg
"Ok, this is ridiculous. We're not getting any calls",neg
"Could FIFA and UEFA possibly look more corrupt after that game? My god, what an embarrassment.",neg
I hope germany wins fuck argentina,neg
Faith in humanity restored.,neg
Do you bury your face in shame when Ronaldo kicks and screams for penalties?,neg
[deleted],neg
USA USA USA USA,neg
When you play with 15 players against 11.,neg
Ya this is a good choice,neg
Not a keeper in the world that would save that? I beg to differ.,neg
"Hey all.  American here.  I've been a fan ohhh ever since Sunday or so.  First and foremost congrats!  I've gathered the whole almost demoted, 5000-1 thing but can I get a quick TL;DR on this racist Thai brothel thing?  And any other noteworthy bullet points.  Congrats again!!",neg
Such an unlikeable likeable player,neg
[deleted],neg
I was actually curious. Post shoots /r/all and the top comment is about banning people with 0 context about this except for a twitter account saying this is about a kid with cancer.,neg
This thread funny,neg
"**ARGENTINA, DECIME QUE SE SIENTE !!!**",neg
-Batman,neg
"Yeah, not many British pure footballers have been knighted. And if Gerrard, Lampard, Giggs or Beckham haven't gotten knighthood, Rooney won't either.",neg
Did anyone tell the England players that Brexit does not apply to the Euro Cup??,neg
"Everyone watching this, I'd like you to try something. If you are watching this on ABC like I am/was (or an affiliate I guess) stop for a second and try and find the local Spanish language broadcast. For me it's channel two. For a couple of minutes compare the two broadcasts.   The difference is subtle but amazing. The crowd in the English broadcast is dull and muted, they seem subdued. In the Spanish broadcast it is much louder and more active, closer microphones I guess. In the English broadcast the announcers are, with a few exceptions, quiet and soft spoken almost as if they were golf announcers. The Spanish announcers are animated and excited. All in all it is so much more enjoyable.   **Edit** I apologize, I was not aware that this, what I thought to be independent, observations was something that would stir up an angry beehive on this sub.",neg
Pathetic,neg
"Actually, it was the britts that started calling it soccer...",neg
Oh that is so sad it's bringing tears to my eyes,neg
Halftime! When the second half begins I want to see a SHITSTORM of goals. I don't care who scores 'em!,neg
"Rest in peace, little Bradley. Inspired so many people and brought everyone in football together.",neg
"If you want to ask a question to stay informed without hate, ask it like this: ""I looked around for some information on who he is and couldn't find anything.  Can someone help?  I'm very sorry for his family.""   The way you originally (especially before the edits) asked the questions made people feel you thought it was unimportant.  Most humans have extreme level empathy when a child dies of an illness and your questions lacked tact.",neg
Schweinsteiger does need to get the fuck out of the way....,neg
"Re worked conversation between Red Skull and Capt America. Thought it would be funny since she is from Brooklyn, and is taking down a corrupt, evil bastard.",neg
Yes,neg
Cheating your way to win must feel good aint it?,neg
"Well, if Barca wins, it's by cheating ofc ;-)",neg
De Gea would have saved that,neg
Glad to see this comment. Ridiculous that people above the age of 14 actually think it's funny to take the piss out of a little lad dying.,neg
Nope. I do feel like it is most soccer though. A game of who can draw the most fouls for the free kick advantage...,neg
"r/Soccer consists all kinds of soccer from Italian serie A to La Liga to international World Cup. While NFL is only NFL, it will be more if add college football to that",neg
Best goal I've possibly ever seen,neg
"It is the equivalent though - you get into the playoffs by being above a certain threshold in the league standings, then you play a knockout tournament to reach the Superbowl, the matching of the two 'best' club sides in the respective sport.",neg
ARG with some nice diving there.  EDIT: And another wonderful dive. I'm happy to see them play like Italy.,neg
"With no helmet, bats or sissy paddings :)",neg
First contribution he's made in 5 years lmao what a goal,neg
"he might, but he's not wrong",neg
So was Barcelona in first half with handball.,neg
Kane and Alli should follow the footsteps of Messi and retire tonight,neg
I hope it goes to Blatter then trickles down to the bottom. CBF and other regional entities are no better than FIFA.,neg
I'm surprised this sub name is soccer,neg
WOOOOOO USA USA USA,neg
"Fuck me, anything people ever talk about nowadays is about ""the best"" this and ""the best"" that. Just appreciate these incredible freekicks. Both are unbelievable and people are always going to disagree about which one is better so it doesn't matter.",neg
What is going on in this comment section? Is this /r/news or something? All  the Americans acting like they just came from Zurich after arresting these guys.,neg
The second pen? The defender didn't even look at the ball..,neg
"nice cheap shots, fucking latin fuckers",neg
"Lads, it's Tottenham",neg
fuck,neg
"great, as if we needed an even bigger influx of yanks on this subreddit.",neg
Yes we should all root for some small town teams in a country we've never been to because that's the noble thing... those big teams have way more brand exposure and are actually broadcasted internationally.,neg
Winner only gets a replica of the trophy? The fuck?  The trophy is tiny and FIFA can't make a new one every 4 years?,neg
"Except for you, obviously",neg
As an American... Come at us now r/soccer!!! USA USA USA USA!!!!,neg
[deleted],neg
[removed],neg
It was a nice goal don't get me wrong but USA didn't create much chances other than the post shot by Bradley,neg
What does this have to do with anything..?,neg
This game is AWESOME. Great last match to end an amazing World Cup. I'll be happy if either team wins but I'm rooting a bit more for Argentina because I want all the drama.,neg
you're welcome.,neg
Obama took out Bin Laden and Blatter. Can't decide which is more impressive.,neg
"Right, but he hasn't done all of this in the same move from my memory... that's pretty much what I just said.",neg
sorry we're bitter when people with no prior knowledge of football talk about it,neg
"No, he had to move left in case Messi went opposite corner. He has to play the statistically highest percent direction the ball is going to go in. There was absolutely nothing Guzan could do about that.",neg
Higuain was pretty dramatic. The ref obviously saw that and took it into account. A necessary challenge and punch by Neuer. Can't get pissed that he's doing his job.,neg
"Nah, Mhkitaryans was Giroud-esque",neg
Highest ever /r/soccer post and 9th highest Reddit post!,neg
Probably couldnt take it anymore after John Oliver show,neg
Yellow for ARG?   Cant believe my eyes ref.,neg
All those complaining sissys probably don't know any rules lol.,neg
