Let people choose who they think is better. Stop trying to make everyone have the same opinion as yours.,neg
"Navas is a good keeper and this was a great goal, great finish, great team play but a taller keeper like Neuer, Courtois, Cech or De Gea would save it",neg
"Not really, but it was to his advantage.",neg
Ronaldo didn't even win the Euros.,neg
USA! Where fucking with sports will get you fined or imprisoned. Collapse the worlds economy? Go have fun and try again!,neg
Aguero is such a dirty fucking sly cunt.,neg
[deleted],neg
Holy shit this is huge,neg
[deleted],neg
&gt; Mascherano is simply a bigger cunt than Pepe.  No way (even though Pepe seems to have calmed down for a while now).,neg
"Hahahah spurs brigade downvoting you  Fuck off spurs, shit team that breeds shit players with shit mentality",neg
"USA, I'm so sorry for every time I bashed on the MLS. I'll even call it soccer for a while if you want.",neg
And the diving.  And the complaining to the referees.  And the other diving.  And the headbutting.  And the rest of the diving.  And more complaining.,neg
"Worst? If you look at all the missed opportunities and poor handling decisions, yes, absolutely. But if you look at this from an entertainment perspective, this is the most exciting 20 seconds of ftbol I have ever seen!",neg
[deleted],neg
Fucking referee!,neg
I wish we would stop with this,neg
I don't think he even cared about Real in that moment. He was just showing his love for Barca.,neg
Lol you'll lose anyway.,neg
Football/soccer business is just a huge front for money laundering. Paying 100 million euros for a player? Give me a break!,neg
"'You're welcome, world' - USA",neg
Sure they are. It's not as though they had decades and decades to stop this going on in their own backyard.,neg
"Ah I forgot Switzerland weren't in Europe, looks my geography's a bit off.",neg
FUCK why you no win in full time Germany,neg
Top of /front too,neg
Not even a card!?!,neg
"I agree. Everyone is all ""this is history"" etc but it's pretty clear Barce had the refs on their side. It's really disgusting honestly.",neg
And you're delusional...,neg
Poor mans Mkhitaryan.,neg
"Geez, England, we get it, you don't want to be in the eu, stop trying to make a point.",neg
You owe me a keyboard.,neg
"1 wrong penalty and 1 questionable, how is this the greatest game you have watched?",neg
He went for the ball. What more do you want,neg
YOU CAN'T HANDLE OUR FREEDOM,neg
You and I both mate,neg
[deleted],neg
"Shhhh, don't interrupt the circlejerk.",neg
"What the fucking hell, that's a penalty, how'd they miss that? Hope Kramer will be alright.",neg
"Stop the press, the S*n needs to write this up   Edit: obviously /s",neg
"I have left reddit for [Voat](https://voat.co/) due to years of admin mismanagement and preferential treatment for certain subreddits and users holding certain political and ideological views.       The situation has gotten especially worse since the appointment of Ellen Pao as CEO, culminating in the seemingly unjustified firings of several valuable employees and bans on hundreds of vibrant communities on completely trumped-up charges.       The resignation of Ellen Pao and the appointment of Steve Huffman as CEO, despite initial hopes, has continued the same trend.       As an act of protest, I have chosen to redact all the comments I've ever made on reddit, overwriting them with this message.       If you would like to do the same, install [TamperMonkey](https://chrome.google.com/webstore/detail/tampermonkey/dhdgffkkebhmkfjojejmpbldmpobfkfo) for Chrome, [GreaseMonkey](https://addons.mozilla.org/en-us/firefox/addon/greasemonkey/) for Firefox, [NinjaKit](https://github.com/os0x/NinjaKit) for Safari, [Violent Monkey](https://addons.opera.com/en/extensions/details/violent-monkey/) for Opera, or [AdGuard](http://adguard.com/) for Internet Explorer (in Advanced Mode), then add [this GreaseMonkey script](https://greasyfork.org/en/scripts/10905-reddit-overwrite-extended).      Finally, click on your username at the top right corner of reddit, click on comments, and click on the new OVERWRITE button at the top of the page. You may need to scroll down to multiple comment pages if you have commented a lot.       After doing all of the above, you are welcome to join me on [Voat](https://voat.co/)!",neg
"Apparently, yeah.  But it's Friday, and I'm off on holidays next week so!",neg
I'm from the USA but I have German heritage and I'm watching this game with friends who are Argentina fans. Let's go Germany! Show my Argentina fan friends that we can win this!,neg
HAHA GOOD ONE! DID YOU THINK OF THAT YOURSELF?,neg
"Let's be honest, no it wouldn't - not this many anyway. I could only imagine this silly a thread if England was the country pressing charges.",neg
What did you guys think of the penalty calls? UEFALONA or legitimate calls?,neg
"**B R E X I T    B  R  E  X  I  T**  Lads, it's England",neg
"not even American, but this morning:  #GOD BLESS AMERICA",neg
and they moved up from 6th all the way to 6th   lol,neg
Fucking shite comments... 'we did it reddit!' 'dicks out lads'  Even ironically they're painfully unfunny and worthless.,neg
[deleted],neg
Why is Argentina still with 11 men on the field? Fucking Italian piece of shit ref.,neg
[deleted],neg
Holy shit,neg
You're welcome =),neg
It's become an instant meme in this thread. It just happens sometimes,neg
Bad comment,neg
That's a red card!!!!!!!!!!!!!!!!!,neg
My favorite fucking player ladies and gents,neg
"Lol best player in history, okay chief.",neg
I don't care about how much they pass. It's the diving that happens every fucking 5 mins that I can't tolerate,neg
"Yeah, with the way Belgium are bottling it?  Fuck off with this opportunistic logic. ENGLAND was poor.",neg
"Shhhh, you're making sense in a reddit thread. ;)",neg
yeah but no barca fan remebers that,neg
I started screaming GOLAZOOOO lol,neg
It's disgusting how frequently the Argentine tackling is going unpunished,neg
Soccer,neg
US soccer=GOAT. Brazil distant #2.,neg
Where in the hell did all of these Leicester fans come from. lmao  The international fans are even funnier. (I'm btw not from the UK or the US. I just find international fans of Leicester funny. Seeing how that club wasn't playing on the highest level until recently. And is a club that usually nobody outside of Leicester even supports).,neg
[deleted],neg
"This thread is currently at 6,958 points",neg
HE'S ARSENE WENGER'S MAN,neg
Thanks Obama!!,neg
[deleted],neg
[deleted],neg
"Its fair enough that these people are being held responsible for their crimes but anyone who thinks that this changes anything in a larger sense is kidding themselves.  And US fans, dont act like this and then be surprised that people dont listen to you in other threads. Ive only seen a small amount of comments and its has been ridiculous and cringe worthy stuff that Im seeing",neg
It's not quite the same when you have to win by cheating penalties though,neg
Sigh. This is a great thing for the world and every single comment is about America. And people wonder why it grates on us... Worse than Arsenal fans for making it all about them.,neg
Cheers.,neg
Not the first time!,neg
fuck off,neg
"well I think giroud + koscielny will contribute more against iceland than all 5 spurs players, but we'll see",neg
calling something unfunny in this context is already a very arrogant thing to say.,neg
"We can brag about a tie.   You, on the other hand, have to search for answers about how you couldn't defend your home turf at the ""mighty"" Azteca.",neg
Like a young mkhitaryan,neg
Its like FIFA intentionally wants games to go into extra time to make more $$. Real Conspiracy theory.,neg
Dirty play from Argentina,neg
Stop,neg
How relevant today... or pretty much everytime Tottenham play an important match,neg
[deleted],neg
We did it reddit!,neg
[deleted],neg
they never finish first,neg
"Howard Webb wouldn't let that shit fly, just sayin'.",neg
in your opinion.,neg
If your name is Sergio Ramos. Fuck you for that disgraceful display.  There is a reason people love and respect Buffon... He carries himself with dignity.  Ramos on the other hand. Well fuck him,neg
"That's fine but then remember those individuals. By all means hate me because I made myself look bad celebrating a win, however hollow you may deem it, against corruption in a multinational corporation. But don't disregard all comments written by American users based on my reaction that one day. And back to my original statement, today's a good day. Might not move the World Cup to my backyard, but it's a start. Who knows how much this could change. Capone went down for tax fraud. You just never know how these things could shake out.",neg
What the fuck right now,neg
Where did all the Tottenham supporters go,neg
"It's not just Americans though, it's ""soccer"" in every english-speaking country except Great Britain (I think not even Ireland calls it football).",neg
"Oh I don't have anything against Americans and I don't hold you responsible for your governments actions.   I just find it funny how so many Americans are quick to disown their government most of the time, but in times like today act as if the rest of the world should get down on its knees and personally felate every American.  Can you not see the irony?",neg
DIRTY ARGENTINIAN RATS. ADMIT YOUR FUCKING HANDBALL YOU COWARDS.,neg
I like to see Messi waste his energy early in the game.,neg
"It actually fucking hurts me on an emotional level that this joke has been made over 3949435943 times and is still being upvoted. The smug look I imagine you have on your face seeing this upvoted thinking to yourself ""man i'm clever"" annoys me more than England leaving the tournament.",neg
Sweinsteiger spent more time faking injuries than playing.,neg
"Fuck the Germans in particular. No, really now, FUCK THE GERMANS, they always have to win shit. You know the saying: ""22 players running on the pitch and Germany still wins""? Exactly.",neg
"Mkhitaryan is a fraud and was offside, all hail lord Giroud.  Flair not relevant.",neg
"I pray that Argentina wins just so all the people posting these pictures and videos like:[this](https://www.youtube.com/watch?feature=player_embedded&amp;v=LNk07gLG3gc) and [this](http://i.imgur.com/XrSkyav.png?1) look like idiots. Germany's good but not as good as they looked against Brazil, and Argentina is a very strong team too.",neg
Argentina have been so lame to watch this entire tournament.,neg
if giroud had mkhi's pace he would have been offside xd,neg
