"Hello to everyone who's been talking shit the past few weeks. ","neg"
"[Hello ](https://gfycat.com/ForthrightJollyHorse) ","pos"
"deleted  ^^^^^^^^^^^^^^^^0.8639  [^^^What ^^^is ^^^this?](https://pastebin.com/FcrFs94k/22774)","pos"
"You know that referees won't get every decision right, right? We get the replays but they have to make a split second decision in real time.  Unless you can provide evidence of corruption and match fixing I suggest you keep your mouth shut. ","pos"
"The ref gave 2 free penalties to Barca.","pos"
"Emery should resign immediately and the officials should be investigated.","neg"
"A betting Mafia or UEFA did this. And Barca players KNEW soft penalties were going to be called for them.","pos"
"Ref MOTM Di Maria fouled - no penalty Suarez dived - penalty  PSG are still bottlers, should never have been this close but the ref was appalling ","neg"
"U MAD?","pos"
"It's tarnished by cunt face Suarez's dive. I know I'll sound bitter b/c of my flair, but the dive was disgusting.","neg"
"Well yea Robben has a diving issue.  But he's never bitten other players, used racist slurs towards other players, hand-balled the ball of the goal-line costing Africa a semifinalist in a World Cup in Africa...","pos"
"Ouch... I had almost forgotten.. No era penal :(","pos"
"Do you bury your face in shame when Ronaldo kicks and screams for penalties?","neg"
"So you guys have gotten questionable calls all season. We get one bad call in our favor and our run is tarnished?","pos"
"Ironic coming from a Madrid fan who probably idolises Ronaldo a famous serial diver.","pos"
"You get it, shame this is downvoted. Kneuzen hier ;)","pos"
"Downvoting you because you said ""real football"" like a pretentious fuck boy","pos"
"no worries, i gotchu","pos"
"I still have no idea what the fuck happened and your post made it more confusing. ","pos"
"I don't know how amazing that is in soccer terms though. Is that bigger than the Pats coming back and winning the superbowl?","pos"
"2 dollars ","pos"
"What did you guys think of the penalty calls? UEFALONA or legitimate calls?","neg"
"First one yes, second one no, saying UEFALONA makes you an idiot.","pos"
"[deleted]","pos"
"[deleted]","neg"
"[deleted]","neg"
"Ronaldo is and always will be in Messi's shadow.","pos"
"Messi and he will seen as neck and neck. The debate will go on forever. ","neg"
"He dives just as much, throws hissyfits resulting in punching and kicking players, is a smug cunt, a massive diva and so on. Yes he is.","neg"
"Yeah Ronaldo would never dive if his team was in that situation. The idea of Ronaldo ever diving is laughable and absurd.","pos"
"What does it matter. He's still right ","pos"
"boo hoo :(","neg"
"[deleted]","pos"
"Yeah unlike Divenaldo","pos"
"A Real Madrid fan complaining about diving.  Can you not add 2 and 2 together?","pos"
"What's your mass to volume ratio cause you're dense af.","pos"
"Comment was posted in a Barcelona vs PSG match thread.  In said Barcelona vs PSG match, Suarez dived.  Real Madrid user says Suarez is a dirty player.   It is implied that they are talking about the dive.","pos"
"Lol. I wasn't the one that made the comment smart guy. Just pointing out the fact that it's not too hard to connect the dots. Sorry if that's too complicated for you. ","pos"
"Pepe is the biggest cunt of all time but why Ramos?? Genuinely curious...","neg"
"&gt; Mascherano is simply a bigger cunt than Pepe.  No way (even though Pepe seems to have calmed down for a while now).","neg"
"Divenaldo? really?","pos"
"No worse than Uefalona comments. ","pos"
"People are way caught up celebrating this comeback by cheating to see his whataboutism.","pos"
"I've never seen Ronaldo holding his throat and gasping for breath after getting touched on the shoulder","pos"
"I forgive him :=)","pos"
"Salty (====","pos"
"Yeah, he's not a nice guy like Sergio Ramos...","pos"
"That was a super soft pk but what about the other 5 fucking goals?? PSG were shot and deserved to lose coming out like that with a 4-0 advantage","pos"
"It's different Barca came out flat and got destroyed, they believed in themselves to come back from a 4-0 deficit and came out fighting.  PSG just had to hold Barca to less than 4 and came out playing scared with no fight in them or any will to win and got destroyed.","pos"
"But that 1 penalty mattered. ","neg"
"That makes no sense. Without the goal PSG would be through. So ofcourse it matters. Yeah PSG played like shit but so did Barca last game.","neg"
"Suarez PK was PK worthy But I still say the Neymar Pk was more debatable.","pos"
"He did what he had to do.  Got a tug on the shoulder and went down. Desperate times call for desperate measures. ","pos"
"Uefalona takes it again.","neg"
"Really happy for him but that was disgraceful by Barcelona and the referee ","pos"
"FUCK SUAREZ THAT CUNT!","pos"
"Ur English i get it u hypocrite,u still crying the 2 goals on brasil, u wish u had him on ur shitty  team","pos"
"Na we just want teams to honour their contractual agreements","pos"
"Nope. Please don't put words in my mouth","pos"
"Adam Johnson","pos"
"Yeah beacuse you guys are probably gonna draw Sevilla or Leicester. I guarantee it. ","pos"
"Assuming City, Atleti and Juve advance, either Sevilla or Leicester is going to be the ""easiest"" team amongst the remaining ones and that's why Real Madrid will draw them. If you don't believe me, just wait 'till next friday and see it for yourself. ","neg"
"Haha cry your heart out. LOL ","pos"
"Suarez needs serious therapy to function like a normal human. Fuck him for the second penalty.","pos"
"Seriously?  Then everything is the world to him. He always acts like a rapid dog with no conscience, no morals, no manners, no respect. I wouldn't enjoy winning a game by cheating like this. Fuck him again.","pos"
"A day after Lewandowski got Koscielny sent off by overselling the shit out of that shove. Chill man, your club is not above a bit of villainy. Hell, your star striker is not much above that either.","pos"
"The ref was a disgrace.","neg"
"I called it a week ago check my post history. With Messi in your team anything is possible and I had that gut feeling! I never gave up believing and neither did the players","neg"
"I guess the standards are pretty low: did he bite anyone? No? Okay then carry on.","pos"
"While I agree, PSG played awfully the whole second half (didn't watch the first). They deserved to go.","pos"
"he will afford proper security after he gets his payment","pos"
"Comment from my ass: pdff ","pos"
"Nooo nooo noooooo no","neg"
"[deleted]","neg"
"I'm sorry, but is nobody going to comment on the disgraceful diving by Barcelona to give the penalties? It baffles me how this isn't a big issue. ","neg"
"Wow the Ref really fucked PSG on this one...Neymar and Suarez flopping all over the field. ","neg"
"Even if they cheated, they CHEATED THEMSELVES OVER A FOUR GOAL DEFICIT. I mean, even playing dirty, that's fucking impressive.","neg"
"I mean 6-1 is fucking insane, but no. Cheating is cheating.","pos"
"&gt; USA  Yeah.","pos"
"That doesn't make sense","pos"
"Yeah, they're celebrating like they earned this shit. Horrible reffing","neg"
"He won't understand that, fans of big clubs on Reddit have rarely been in the same nation as the team they support.","pos"
"Their style is so boring to watch. pass, pass, pass, pass, dive, score, pass, pass, pass...","pos"
"lol you know the salt levels have reached critical mass when /r/soccer bros are complaining about your ""boring play style"" after an amazing 6-1 victory. Keep the tears coming, boys. I'm looking to fill up a large salt water aquarium today.","pos"
"This sub is retarded.   ""PSG didn't deserve to win because they lost a 4-0 lead""  ""But if they had conceded one goal less they would have won, and one of those gosls shouldn't have been allowed""  ""They didn't deserve to win.""  ...","pos"
"Case in point.","neg"
"Two dives though. Neymar for that first and Suarez for that last one.","pos"
"they lost by one.  one of the goals was from a dive.  is it really that hard to get?","pos"
"Yeah but you are not giving them any credit for scoring 4 (four) goals on the first game. If you take the last goal out, both teams scored a total of 5 goals over two games, yet you are praising one of theem because it scored these goals after the other team? It just doesn't make sense.","pos"
"The thing is though, even if the goal wasn't worth 7 points it *did* put Barca through. So what you said isn't correct.","pos"
"I blame the Russians","pos"
"Well, if Barca wins, it's by cheating ofc ;-)","neg"
"I guess Suarez with his dive.","pos"
"suarez penalty was clearly a dive..","pos"
"They say it, so they can claim the cheating-money are tax refundable. ","pos"
"It's not a joke, it's the game. You people really need to realize that instead of seriously complaining and feeling outrageous.  They dive because it works. You would too. The games they don't dive are the games that they don't desperately need to win, but that's it.  It's not even the ref's fault, they're allowed to feel pressure and make mistakes. The best ones are the ones that do it less, not the ones that never do it.   It's just how this game is, and have always been. Unless you punish the player/organization after the match with replays and stuff like that, it'll keep happening, and it seems like you guys will keep complaining.  edit: I know you're pissed and all, I'm not saying to not be pissed. Just don't be silly and act as if a player diving was something outrageous, and that the Ref should know better. Suarez did what he had to do and in perfect position to mess up the Ref's call.","pos"
"&gt;but those two penalties were the total difference  Talking about the first penalty makes you seem biased. It wasn't on purpose, but it was a penalty.  Suarez totally dove. Do you think he did the wrong thing? Do you think you would've done anything different?  But most important, do you honestly think PSG players wouldn't have done it, if the opportunity arose in that game, or any other one? ","pos"
"Its part of the denial of the defeat i think (or just straight up hatred for barcelona). The first penalty was blatant for sure. The second one wasn't but propably looked like it from behind (where the ref was standing) so I can atleast understand why the call was made. The Di Maria one was not a penalty (I think he was down on the ground out of frustration for blowing the chance, not injury)","pos"
"Not necessarily cheating, they aren't breaking any rules. Playing dirty and have a ref call in your favor is the refs fault","pos"
"Still hasn't seen that Mascherano tackle on Di Maria","pos"
"Clear penalty. Not given...","pos"
"Sure, let's just ignore that Cavani and Di Maria both wasted a clear cut chance each...","pos"
"Absolutely disgusting dive, but don't let that distract you from PSG blowing a 4-0 lead.","pos"
"Both of them","pos"
"He needs to be punched","pos"
"The French have never been famous for holding their ground.","neg"
"When you play with 15 players against 11. ","neg"
"No they didn't","pos"
"Well played Barca. But this was only possible due to Suarez diving to get the second penalty and that time the official behind the goal line did not intervene.","neg"
"I'm a plebe whose soccer knowledge is limited to playing Fifa sometimes and watching the world cup every 4 years. Context?","pos"
"Not a soccer fan but something crazy obviously happened here. I have a question though, if FCB was up 5-1 already, then why does making it 6-1 historic??","pos"
"Beside it being a massive comeback, I'm not sure how people are saying that was one of the best games they've seen as a neutral. That game was fucking terrible. Full of both teams not playing to their capacity, diving and fouling and bad calls all over the place. It wasn't a good game.","neg"
"""futbol""  fuck off","pos"
"sorry we're bitter when people with no prior knowledge of football talk about it","neg"
"[deleted]","pos"
"Don't care much about either club but Suarez should have been sent off instead of getting a penalty in the end. Bullshit like that is ruining the sport, grats Barca on getting to the quarter by cheating.","pos"
"I am Barca fan but surprisingly after watching three different post game studios, every single ""pro"" has thought that it was tight situation but after all the defender lift his hand to Suarez's line and even with very minimal contact that would not be wrong to give the penalty. Now im not giving my opinion but purely what thease commentators/pundits said.  I think that Suarez made himself to look stupid with the way he went down, but as of right now IM SUPER HAPPY!","pos"
"WHAT THE ACTUAL FUCK","pos"
"Lol PSG got robbed, they blew it but still that dive by Suarez was awful","pos"
"Yea, pretty pathetic. They should be given fines, not penalties. Feel so bad for psg and their fans, absolutely brutal ","neg"
"lol coming from a barca fan. I give them mad credit for pulling off the comeback of a century, beautiful clutch last second goal and Neymar's strike was a gem, but both penalties were weak sauce ","pos"
"Same did PSG but they lost so no one cares.","pos"
"You have no clue what the rules are","pos"
"Diving is not cool. It's against the spirit of the game. He's a cheating bitey cunt.","neg"
"Unbelievable. Honestly the ref probably only gave it because he still thought they had no chance. ","pos"
"So pissed off. What should have been a blatant second yellow for diving turned in to the catalyst for Barca's momentum. Dead and buried until that point.  Also they never showed the Di Maria replay... Was he fouled or not?","pos"
"[deleted]","neg"
"This is a stupid way to put it. Everything from 0-0 right up until 5-1 was still a PSG win. 1 goal decided it yet several of their goals either involved blatant diving or players who shouldn't have been on the pitch (Neymar and Suarez).","pos"
"The second pen? The defender didn't even look at the ball..","neg"
"He said the second penalty call - I'm assuming it was when the long ball was played into Suarez and the defender made no attempt to play the ball, looked straight at Suarez.  I agree on Di Maria's chip, I would need to see it again.","neg"
"Man I at the edge of my life right now, I don't get it    All these people saying how amazing it is etc, call me salty or whatever but I don't think Barcelona deserved the win they had    The referees were clearly in their favor   Bad day","pos"
"Salty? No, just downright moronic. I'd be ashamed if I was you. ","neg"
"When you play Barca, you play more than the 11 men on the field. You play the entire Uefa organisation","pos"
"Robbed? They just blew a 4-0 lead. A dive by Suarez doesn't out weigh that. ","pos"
"No it doesn't. Referees make mistakes in all games, and today we haven't seen more of them usually. Definitely not 6 goals worth of them.  PSG fucked it up. I blame Emery for parking a double decker so deep.","pos"
"Agree 100% with this. But the ref did everything to help Barca","pos"
"Hello people from r/all. Here's a description about the importance of the goal. There's a tournament called the Champions League, where the best teams in Europe play at this stage of the tournament. There are always 2 games between those teams, where one team plays at home and away. Now, the first time they played, Barcelona lost 4-0 to PSG. Everyone thought it was over. There has been 0 teams in the history coming back from such a deficit. No one was really expecting anything, but as the game started, Barcelona scored an early goal. During first half time, Barcelona were leading 2-0 (still 2 goals away). Then, at second half, Barcelona scored another early goal making it 3-0. Now they are 1 goal away. There's about 40 minutes left to play and everyone got hyped up and were looking at an historical moment, atleast for a start. As the hype built up, Barcelona conceded a goal making it 3-1. This means Barcelona must win with atleast 6 goals. This 3-1 scoreline was within the last 20 minutes of the game, and the hype that was built up, was soon vanished. I mean, who can score 3 goals in 20 minutes against a top tier team? Anyway, as the game went on, Barcelona scored 4-1. Everyone was like, meh, a goal that doesn't mean much. Then 5-1 came, with a few more minutes to play. Then the unbelievable happened and they actually turned it around, and the goal in the video is the last goal they needed to advance and qualify, and it really happened. All in all, no one expected a advancement from Barcelona. But as they took the lead early on, everyone was building up hype and soon came the counter goal and the hype was dead until they turned it around by 3 magical last minute goals.   By /u/sutro19  ","pos"
"Somebody should really introduce challenge and cards for diving, fuckin Suarez and Barcelona","pos"
"But diving is okay, right?","pos"
"Suarez did overreacted but there was contact.Its not his fault that he dived because refs do not see contact many times and dont give fouls unless you go down. Its best example was seen in Man City vs Spurs were City were denied a clear penalty for foul on Sterling because he did not go to ground","pos"
"cunts","pos"
"r/all here... I get that barcelona came back from a huge (aggregate?) deficit but what were the ramifications of this game/goal?","pos"
"Worst ref ever","pos"
"I thought it was a Tuesday?","pos"
"If there's a video replay in this game, PSG gets a PK and the Suarez penalty is taken away. Shame such a historic match was so heavily influenced by the referee.","pos"
"Everyone thats happy about this score is what is wrong with football. No matter who your team is tonight was one of the biggest robberies i have ever seen","pos"
"As an American who didn't understand why a lot of Americans only watch Barcelona, now I understand why they only watch Barcelona.","pos"
"I want to cry :( for real. this is so unfair, cunt suarez diving to make it happen, they dived the whole game, just one yellow for Neymar. Seriously, dived the whole fucking game.","pos"
"Two players offsides. And the Suarez penalty in the box setting up the Neymar goal was a weak ass flop. I'm not a PSG fan, but those goals were absurd. ","pos"
"Suarez is such a dirty player. 2 penalties that shouldn't have been given. But of course, when it's Barcelona in the Champions League anything can happen with the refereeing decisions.","pos"
"AND AN AWAY GOAL!","pos"
"BEST GAME IN THE UCL HISTORY!!!","pos"
"SIIIIIIIII ","pos"
"AAAAAAAAAAAAAAAAAAAAAAAAAAAAAAAAAAAAAAAAAAAAAAAAAAAAAAAAAAAAAAAAAAAAAAAAAAAAAAAAAAGGGGGGGGGGGGGGGGGGGGGGGGGGGGGGGGGGGGGGGGGGGGGGGGGHHHHHHHHHHHHHHHHHHHHHHHHHHHHHHHHHHHHHHHHHHHHHHHHHHHHHHHHHHHHHHHHHHHHHHHHHHHHHHHHHHHHHH!!!!!!!!!!!!!!!!!!!!!!!!!!!!!!!!!!!!!!!!!!!!!!!!!!!!!!!!!!!!!!!!!!!!!!!!!!!!!!!!!!!!!!!!!!!!!!!!!!!!!!!!!!!!!!!!!!!!!!!!!!!!!!!!!!!!!!!!!!!!!","pos"
"HAHA reddit is crashing","pos"
"I hope they ban suarez for a lifetime.","pos"
"This is it. This is the pinacle of my life. There will never be a moment more incredible than this in the rest of my existence.","pos"
"FORCA BARCA!!!!!!!!!!!!!!!!!!!","pos"
"we have just witnessed history! what a game ","pos"
"             PSG","pos"
"what a joke","pos"
"Cheating and corruption for the win. Watch out for the investigation. ","pos"
"That was disgusting ","pos"
"and The Oscar Goes To","pos"
"BENEFICA BLEW A 1-0 LEAD","pos"
"""I'll buy that for a dollar!"" ohh, someone actually did that. (Barcelona)  Been a lot about ""fake news"" lately but ""fake football""... Barcelona take football to new hights.","pos"
"FML","pos"
"I CANNOT BELIVE IT. I after that first goal I was talking to myself ""Belive, belive, you never know.""  Then after 3-1 I was talking to myself ""Im proud of the team and we can win Liga if we play like this"" Now it's been 2 hours and I can't sleep.","pos"
"MFW im a Barca fan and turn off the game when PSG scored, only to play CSGO with some friends. . . .","pos"
"That amount of contact is never a penalty without the dive. And the contact with the knee is after suarez dives. ","neg"
"https://www.youtube.com/watch?v=n7_3J0p3alc","pos"
"Only autistic Americans care about such minor sports. ","neg"
"r/all if you wanna know what really went down during this match, sort by controversial","pos"
"Comment tu veux gagner la CL avec Cavani, Pastore et Thiago Silva ?   How do you want to win the CL with Cavani, Pastore and Thiago Silva ? This Club needs more great player","pos"
"uefalona","pos"
"[deleted]","pos"
"To those from /r/all, this was the 3rd goal Barcelona scored in 6 minutes to beat PSG 6-5 on aggregate. It's also the first time in history a team has overturned a 4 goal deficit form the first leg in Europe.","pos"
"THis is the greatest CHAMPIONS LEAGUE comeback in all time","pos"
"Naa this is better. 4-0 down, then PSG score the away goal? Last minute winner? Lovely stuff","pos"
"It's not quite the same when you have to win by cheating penalties though","neg"
"This still hurts even after 12 years and Athens","pos"
"This supersedes that, IMO","pos"
"By far. The biggest so far has been a 2-0 deficit.","pos"
"Fair point but pique shouldve gotten red. A penalty for PSG for handball in first half, etc.","neg"
"Go back to your cave","pos"
"Like when Suarez dives for pens","neg"
"What the fuck","pos"
"wat ","pos"
"So close for PSG ...","pos"
"I can't handle this ","pos"
"this has to be one of the worst refereeing performances in the CL in a long time","pos"
"Suarez robbed PSG.","pos"
"The ref helped sooooo much. Dirty play from Suarez, but confusing from the referee. Suarez was getting roughed up all night and that's what he gives a penalty for?  With that being said, astonishing result, and PSG have no one to blame but themselves. ","pos"
"I guess slavery and terrorism money doesn't pay in the end.","pos"
"Truly unbelievable! ","pos"
"first trump, then the patriots, now this? does reality matter anymore? edit: also brexit","pos"
"Lol..Fans of minion clubs from EPL calling them cheaters..Seriously...Cheating also means passion for football which you guys dont have...Respect from RM fan...Barcelona played their hearts...Who cares about the fucking dive? Win is more important","pos"
"Isn't he offsides?  Edit: Nvm, saw in AA he wasn't. Well done, wow.","pos"
"Barcelona can thank the ref for that one.","pos"
"This is the most blatant thing example of FIFA scripting","pos"
"I watched a great game but I feel so bad because Barca won :(","pos"
"Pure scum decisions. The second penalty was such a joke, I said at the start of the game Barca will win a penalty to give them a chance at the end. Such a pity as the winner was brilliant","pos"
"As a person that is coming from all, why is it a big deal that a team won 6-1 vs 5-1? ","pos"
"PSG won the first leg with 4-0 at home. This means that Barca ould have needed a 4-0 as well to go into over time, or a 5-0 to proceed into the next round directly.  PSG scored one goal though. You would think that that means that Barcelona need a 5-1 to go into overtime (making it a 5-5 aggregate), but in soccer there is an away goal rule, in which an away goal is weighed heavier than a home goal, meaning that in case of a 5-5 aggregate, PSG proceeds directly. There can be no extra time.   So, to proceed, Barca needed a 6-1 win, and they did it, going from 3-1 to 6-1 within seven minutes or so.  This is incredible. ","pos"
"PSG won the first game 4-0. That means Barcelona would have to equal that in this second game to send it to extra time, win 5-0 to move on or win by 5 goals if PSG score 1 because of the away goals rule. Basically 185 teams have led 4-0 after the first leg and this is the first time in history a team has come back in the second leg to move on ","pos"
"There are two games played between the teams. The team that advances is based on the combined (aggregate) score between the two games. ","pos"
"They had a four-nil advantage from the first leg, conceded thrice, scored once (giving them an away goal, which count double), then conceded thrice more, leaving them a goal down overall. Hope this helps.","pos"
"Correct, they win 6-5 on aggregate.  What's even more incredible, is they also overturned an away-goal advantage.","pos"
"So I got up and open my computer saw 2:0. Been a barca fan, I am like emm we have a chance. Lets see how it goes.  I went to take a shower and prepare my breakfast. Came back and saw the first penalty. 3:0. Ok Now we are really in it.   I think I shall stay back and watch the rest of game before going to work.  After eating my breakfast, it was 3:1. I am like it is over, time to go to work. So I turned off my computer and left.  Got to work and saw 6:1.  WTF. This is just beyond amazing. This is crazy. ...","pos"
"WE FREAKING DID IT I LOVE BARCELNA YESSSSSSSSSSSSSSSSSSSSSSSSSSSSSSSSSSSSSSSSSSSSSSSSSSSSSSSSSSSSSSSSSSSSSSSSSSSSSSSSS","pos"
"So the NBA had the Cavs historic comeback. The 73-9 Warriors (best in-season team of all time) blew a 3-1 lead in the finals.  Then the MLB had the Cubs historic comeback. The Indians (being from Cleveland it hurts to say this) blew a 3-1 lead. And the Cubs ALMOST lost that game on what would have been the greatest single-game comeback in World Series history.   Then in tennis we somehow we had another showdown between Rafael Nadal and Roger Federer in a finals match. Something no one thought we'd see again.   Days later the NFL had the Patriots' historic 25 point comeback to beat the Atlanta Falcons.   And now, still within a year from the Cavs upset of Golden State, we have this Champions League upset.  Has this much drama ever happened in a single year of sports?","pos"
"FROM /r/all someone explain plz","pos"
"[deleted]","pos"
