"Dier was probably the only player today who had a decent performance. Kane and Alli were 100%, pure, unadulterated shit, along with the rest of the ""team"". What a bunch of overpaid wankers lead by an incompetent coach. The last 30 minutes we were out of ideas and nothing worked, still he waits until 3 minutes from time to use the last sub. What a bloody dolt.","pos"
"Everyone played shit except rashford ","pos"
"&gt; rashford  Didn't have enough time to be shit","pos"
"lol","pos"
"Lads...","pos"
"It's ridiculous that it was mostly Spurs player anyway. Walker over Clyne simply because he plays for Spurs and Roy wants a theme going on. Alli not ready for England yet but lets keep him in. And worst of all lets keep Kane and push Vardy and Sturridge out wide because somehow that helps us score goals","pos"
"twice in a less than a week England wants nothing to do with Europe","pos"
"##~~E~~  I   ##~~A~~  C   ##~~S~~  E   ##~~Y~~  Y  ","pos"
"Thanks KSI. ","pos"
"Joe Hart should get ""MUG"" tattooed across his fucking forehead. ","pos"
"/r/all, here we come","pos"
"Who missed that last header?","pos"
"Lads, they're coming home","pos"
"I don't know why Rashford wasn't given more of a shot in this tournament.  I get it, he's young, he's unproven, but what makes him more unproven than say Kane at the international level? Why not roll the dice with youth instead of sitting on your thumb and doing nothing?","pos"
"Why was Deli Alli on the pitch 90 minutes. He didn't even look like he wanted to jog let alone play the rest of the game.","pos"
"England played like a sack of shit and Premier League is the most overrated thing ever. ","pos"
"Real joke's on Wales. They lost to this English side.","pos"
"Rushford should have started this game and England would have won. To beat Iceland you need pacy  dribblers who will  take them on cause their defenders just know the basic, block and clear the ball. Rushfords   runs nearly opened them up. He really tried but looked nervous as he was really trying, he would have settled so well if he had started!","pos"
"England: Brexiting out of everything like a boss.","pos"
"I'ts a volcano.","pos"
"Before Roy quits, pls fire him. he doesn't deserve a graceful walk off from the England team, he needs to be fired .  Rooney Retire. Joe Hart dropped from the squad. Stop with the hype around Sterling, he clearly over rated.","pos"
"Is there a video of the icelandic commentator in the final seconds?","pos"
"EuroCup: England, you're breaking my heart! You're going down a path I cannot follow!  England: EU, you turned her against me! EU: You have done that yourself! ","pos"
"ATLEAST ONE SWEDE IS STILL MAKING WOES IN THE EUROS. ","pos"
"""Portugal you're so shit drawing against Iceland!""","pos"
"This pleases me. ","pos"
"I thought this place would be packed with Brexit memes but surprisingly there aren't many.","pos"
"Welcome to the EEC.","pos"
"[deleted]    ^^^^^^^^^^^^^^^^0.5746   &gt; [What is this?](https://pastebin.com/64GuVi2F/22741)","pos"
"Well, England wanted to leave all things Euro...","pos"
"Bowie and Rickman dying, Ben Stokes, Brexit, and now this  How many more times can 2016 kick England in the nuts?","pos"
"Maybe the FA will start investing in grass roots football and make changes to our game that we actually need.  Don't bet on it though.","pos"
"Not even Joe Hart can keep them in the EU(ros).","pos"
"Hairy balls!! ","pos"
"IN LEGENDARY THREAD","pos"
"I made a pissed as fuck 6 euro bet for Iceland to win the tournament on the opening night. 150/1  plz let memes be real!","pos"
"They keep saying one of the biggest upsets!!! Hiw is it an upset? England was terrible...","pos"
"they got brexited","pos"
"Am I the only one that feels bad for the truly talented english players?   Who on Earth could stop that Rooney penalty?","pos"
"If Portugal defends for 120 min and scores a goal oh wow what a boring game eww they didint deserv to win those cunts pepe this Ronaldo that. Iceland scores 2 lucky goals on counter. And defends the rest of the game. Oh wow amazing oh mmm dick sucking iceland were s good 8% this dentist that population size blah.","pos"
"absolutely, I've been saying this for ages, English players have the worse tactical aptitude in Europe, they are light years behind other countries. The BPL totally suits these players, it's why the games are so open all the time.","pos"
"Holy shit this place upvotes some absolute nonsense. The Premier League is one of the best leagues in the world (probably only behind La Liga) it's ridiculous to suggest these players haven't played vs good defense. This is especially true when you consider Iceland, Slovakia and Russia obviously aren't better than Premier League teams.  Premier League players feature for pretty much all the teams in Europe and do fine for them. Pelle had no trouble vs Spain's defense for example.","pos"
"&gt;maybe having players only from BPL doesn't help at all, they don't know how to play vs good defense.   Most of your team plays in the BPL that's not why they lost. They just couldn't deal with the pressure.","pos"
"You get downvoted in this subreddit if you say that bpl is a bad league, but everyone knows it is true. La liga dominates now 10 times more.","neg"
"But against Italy, not Iceland lmaoooo","pos"
"Mmmmmmmm tasty english tears.","pos"
"Yeah Spain fell to the perennial minnows Italy, who certainly do not have a good league. /s ","pos"
"Hey England, you can't have a referendum over this exit!","pos"
"I'm sorry but I have to say it: Shitty Tottenham players. Didn't do anything all tournament. Also, Rooney you suck","pos"
"God awful performance and it was clear it was gonna be like that from the very first few warm up games!  Seriously this is what needs to happen to even remotely salvage this team going forward:  Hart - Phase out of international football, excellent keeper, but holding back players who don't make mistakes like he does  Cahill - Phase out of international football, quality mind but I see no leadership from him  Smalling - Keep grabbing players like that and you'll be beaten on set pieces every day of the week  Rose and Walker - Learn to beat the fucking man, or fuck off! Sick and tired and seeing these two only seemingly making it to the half way line before releasing the ball when there is often 30-40 yards of space beyond the man ahead of them. The defender either knocks it out of play for a throw in or you beat him and leave him for dead! Can't do that? Fuck off.  Wilshere - Decide what matters, and focus on your club career! If you get better, come back to England, its always there for you. But two games in a season proves you're not capable, physically nor mentally!  Dier - Young and learning, keep pushing and it will get better!  Rooney - Retire from International Football! Get whatever accolades you're close to beating in whatever friendlies come ahead in the next year, but its time to go mate.  Alli - Sort out the mentality and you'll be the #10 for years to come!  Sterling - Composure and desire doesn't always seem to be there, this needs to improve otherwise the 40+ million spent on you will be a disgrace for the performances displayed this tournament.  Kane - Step up as a leader and prove yourself, a top 4 club player, the country will look to you, if you can't cope, you can't lead and you can't win!  Vardy - Age and the season to come will determine whether you are a flash in the pan player! Prove the doubters wrong and earn that CF position outright!   Rashford - Young and with tonnes of heart, keep doing you and work on the composure! You will be the future of this country!    This is all my opinion, but honestly, the country constantly gets behind these players, spends a fortune to support them and what we get are a bunch of uncomposed headless chickens on a playing field! Things need to change!","pos"
"Portugal a country slowly growing on Spain like a wart.","pos"
"So ""Burn them all!"" ?","pos"
"Harry Kane is shocking","pos"
"Can't wait to see all the clever, witty Brexit and ""how does it feel to be beaten by a supermarket"" jokes.","pos"
"They lost to a country whose only claim to relevance was a fucken volcano pmao","pos"
"S r/soccer is sucking icelands dick now. Have fun guys keep on sucking","pos"
"I feel like since in a year it will only be England and Wales left in the UK, it might be time for them to combine football teams since England is just utter shit","pos"
"[removed]","pos"
"[removed]","pos"
"The Fall with King's Landing","pos"
"Fucker!","pos"
"Seriously, how many different, stupid ways are England going to get dumped out of tournaments? Like we've often dabbled in the heartbreaking penalty loss, there was the ""goalkeeper can't jump"" moment, the hand of God, the ""lol Rob Green"" and the classic ""it was over the line but you said no and the Germans then proceeded to bend us over and shaft us"", but the losing to clear fucking underdogs has shown that the Gods still have plenty of new ideas as to how to fuck with this team.  Fuck Roy Hodgson, and have a shit retirement you peacock looking bastard.","pos"
"BREXIT 2.0 ","pos"
"Brexit round 2","pos"
"Brexit 2.0","pos"
"God I'm not even English but I fucking hate England and couldn't imagine being a native supporter ","pos"
"FADE THE FLAIRS","pos"
"The dutch? Rekt The Portuguese? Rekt Hungary? Rekt Austria? Done for   I for one, accept our scandinavian overlords.","pos"
"The value of Sterling tanks again","pos"
"Rashford came on and did more in 5 mins than Kane, Sturridge and Sterling put together","pos"
"On behalf of Scotland who have just been fucked over by England in the EU vote, Thank you Iceland! You played incredible well we're very happy for you lads","pos"
"Haha stupid england, /r/soccer triggered","pos"
"Liverpool fans most knowledgeable?  Erm, no","pos"
"One of the biggest shocks of all time? No. That is doing a big disservice to Iceland also people seem to forget that England are an incredibly overrated team.  They have very average players. Cahill is not international quality. Rooney has been declining rapidly for some time now. Kane and Sterling were terrible.   The Premier League is a fraud. World class wages for average pretenders. ","pos"
"Not bad for a small mentality team.","pos"
"I don't fucking care, Bud Spencer just died, football doesn't matter today","pos"
"Get me the fuck out of this cuntry. Most embarrassing 4 days in recent history ","pos"
"#Brexit","pos"
"lol England. Making the news for all the wrong reasons this week ","pos"
"""Lord Nelson, Lord Beaverbrook, Sir Winston Churchill, Sir Anthony Eden, Clement Attlee, Henry Cooper, Lady Diana, vi har sltt dem alle sammen, vi har sltt dem alle sammen! (we have beaten them all, we have beaten them all!). Maggie Thatcher, can you hear me? Maggie Thatcher ... your boys took a hell of a beating! Your boys took a hell of a beating!""","pos"
"Chokelahoma","pos"
"Iceland celebrating like they beat 477.000.000  worth team ...Small mentality...","pos"
"Bring back the Home Nations tournament.","pos"
"#Coming Home Status: Not","pos"
"F","pos"
"Lol! Nice one England. That's what you get for the fucking arrogance of assuming your were gonna walk the Iceland match. ","pos"
"It's funny  how the Premier League always gets blamed for England failing. When was the last time england had a proper coach in charge?","pos"
"England goettin booed by their own fans again. This is too good","pos"
"Second Brexit","pos"
"#enxit","pos"
"Well the UK did vote Brexit...","pos"
"HAIL, PEOPLE OF ICELAND: https://www.youtube.com/watch?v=m7D1TRXErBs","pos"
"I don't follow the international soccer scene too closely: can someone tell me if England has had a really bad team all season, or is this a complete and utter shock with no forewarning? ","pos"
"titanic music makes it all even better: https://twitter.com/TitanicGoal/status/747545679996792832","pos"
"Brexit","pos"
"But still.. Iceland got a small mentality right?  best regards, CR7","pos"
"I just want to say that I am so, so fucking happy for you Icelandianists. I don't know how you're supposed to make it past France, but god damn it do I hope you somehow pull it off. Amazing. Just amazing. 17/10","pos"
"Beaten by a country that has more volcanoes than professional footballers","pos"
"Forgive meI don't really follow football; what's so important about this game in particular? It seems as though this was an upset.","pos"
"I had a feeling Iceland would cause some trouble for England but didn't see it being this much!  I actually thought England would go pretty far into this tournament before it started for once but bad luck this time.  Wish you guys better luck for the World Cup.  I bet it must feel great to be one of the few Icelandic people on the planet today!  Looks like you guys are facing us in the QF.  I hope my team does not foolishly underestimate you guys...I'm more than a little nervous after seeing you guys slay England.  But hey, if we lose, do we get free whale-watching too?  :) :P","pos"
"This is fucking awesome but I'm in the US and no one seems to give a shit. Not very exciting here","pos"
"Brexit ","pos"
"So as a redditor that don't follow soccer.. Why is this a big deal?  Edit: Downvoting a guy for asking a simple question. Stay classy reddit.","neg"
"because google, dude","pos"
"Haha Spurs be cunts eat shit ","neg"
"La liga :  barca or Madrid (every year)  bundesliga : Bayern (every year)  English premier leauge : Leicester  You can't tell me that this leauge isn't the best in the world ","neg"
"Even that is dumb though. Look at Atletico or Wolfsburg or Montpelier. ","pos"
"They're boss on fifa. Maybe you just can't play. ","pos"
"[deleted]","neg"
"he might, but he's not wrong","neg"
"[deleted]","neg"
"Its pretty funny honestly","pos"
"Hey all.  American here.  I've been a fan ohhh ever since Sunday or so.  First and foremost congrats!  I've gathered the whole almost demoted, 5000-1 thing but can I get a quick TL;DR on this racist Thai brothel thing?  And any other noteworthy bullet points.  Congrats again!!","neg"
"they're both better than you mate","pos"
"See you in the CL next ye- oh nevermind.","pos"
"Where did all the Tottenham supporters go","neg"
"WE DID IT REDDIT","pos"
"Yep, that time Vardy racially abused an Asian man has now been removed from history apparently","pos"
"I'm a tottenham fan but I'm glad they won the league, they may never get the chance again","neg"
"Same could be said about Tottenham.","pos"
"Only Watford winning the premier league or England winning the world cup could top this for me. Slightly disappointing that sport will probably never be this good again. ","neg"
"Just shut up and enjoy the history.","pos"
"Leicester will get raped in the champions league next year.","pos"
"I hope they get in atletico's are Real Madrid group, and we get see to griezmann or cr7 put 5 past them in 5 mins lmao. This whole thing sounds like a farce, the premier league is a joke.","pos"
"One of my best friends is from Leicester so when we started watching them last season in the premier league I naturally supported them too. Love the underdog.","neg"
"[deleted]","neg"
"Here from r/all. Know nothing about soccer. How does someone win when it's a tie? A points system I assume? Thanks","neg"
"&gt; We've gone from playing the best football  The best football is played by the best team. Leicester.  &gt;being plastered in the media as the big boys out to crash Leicester's party - all while doing this massive favour to football.  No one is plastering Tottenham for this. I hear this comment from Tottenham fans all the time. However, I never hear it from someone else...  &gt;Still. Congratulations to Leicester and to Jamie Vardy especially, who's performances this season allowed for his right to be forgotten as a racist.   Oh, whining and bitching, are we?  ","pos"
"[deleted]","pos"
"I got u fam","pos"
"Suck a dick, Americans with your football. This is passion, this is excitement! ","pos"
"[deleted]","pos"
"Just wanna be apart of the comment thread when people look back on this in years time. Hi,future people, how did you end up here?","neg"
"Now for City to come 5th. When money was fucked over by hard work and plain will. ","pos"
"I'm so happy that Chelsea got to give the league to Leicester. And that Hazard's first home goal in a year is what fucks Tottenham. Because fuck the Spurs","pos"
"[deleted]","pos"
"[removed]","neg"
"Why is this being consistently downvoted? I can understand Spurs being sour but come on!","neg"
"Are Chelsea the heroes today?","pos"
"[ha ha Spurs are shit!] (http://rs829.pbsrc.com/albums/zz216/Peacefulrain09/TV%20Shows/Animated%20TV%20Shows/The%20Simpsons/NelsonHaHa.gif~c200)","pos"
"[deleted]","pos"
"Wun Wun, Gerrard 0. ","pos"
"https://i.imgur.com/rxrSjIq.png","pos"
"This warms the heart, Leicester definitely deserve it.   It's like I'm experiencing a deja-vu, because a similar thing happened in my country's league (the Saudi pro league), a small team with a budget of $4 million managed to win the league for the first time in their history in the 2012-2013 season, they managed to best the top 4 teams with budgets around $27 million.   I'm just glad I witnessed a miracle happen and lived it through every week till the end.  Congratulations Leicester City!","pos"
"FUCK IT, if we can't have the upvotes, let's at least make it a 10,000 comments party ","pos"
"[deleted]","pos"
"CAN I GET AN UPVOTE IN THIS PARTY","pos"
"I'm calling it now, 2017 Champion League Champs, Leicester City","pos"
"Vardy 1 Gerrard 0","pos"
"Lol. This won't last  Edit: Looks like half of you guys don't understand the joke. That's what people have been saying all season.","pos"
"This thread had over 18,000 upvotes a few hours ago, what happened? ","pos"
"The percentage of upvotes is still 86%","pos"
"ALLLLL ABOARD!","pos"
"Flair checks out. ","pos"
"I was at Leicester market to buy some rizlas on Saturday so I can safely say as their new number 1 fan that we're HAVIN A FUCKIN VARDY PARTY!  P.S Congrats to the Jester from Leicester Mark Selby for making it an international winning year for Leicester after hammering Ding in the Snooker!","pos"
"I'm only commenting to say I was here to witness this momentous occasion. Let the karma flow!","pos"
"Just posting here to be part of Reddit history. Congrats Leicester! ","pos"
"next thing you know Gibraltar to win the European Championship :D ","pos"
"There's too much English shit going on. It's confusing. I'm not sure who to congratulate but congratulations.   ","pos"
"Eden fucking hazard","pos"
"[deleted]","pos"
"Who the fuck would give gold to someone posting a twitter link ","pos"
"Congratulations, you win the karma race.","pos"
"Time to change my flair then.....","pos"
"It's both a great and a sad day for football.   Great because it shows anyone can win and football can be unpredictable.   Sad because they don't have a hope in hell of repeating this next year and therefore it could be considered a complete fluke like Greece in the Euros and Porto &amp; Liverpool in the Champions League. Winners but not great winners or legendary teams which is what we all want to see.  All of the big sides have been poor this season and are going through managerial changes. This season was Arsenal's chance to take the reigns (the last big side in the race) but because they bottled it which opened the door for Leicester or Spurs to win. ","pos"
"i chose Leicester last season after their escape from relegation as my BPL team. What a glorious day.","pos"
"In March 2015, King Richard III was buried in LEICESTER  cathedral after being uncovered in a car park in LEICESTER. In 2015 LEICESTER City managed to stay in the premier  league and win it in 2016.  This is the first time LEICESTER have won the Bpl and the first full season since Richard's body has been at peace.   IS THIS A COINCIDENCE?   I THINK NOT!","pos"
"Someone give me gold ","pos"
"The Spursiest thing to ever happen","pos"
"holy shit top reddit post of all time?","pos"
"But did they make the playoffs?","pos"
"I don't follow sports, can someone explain why this is so significant/impressive?","pos"
"People from r/all came over and down voted ","pos"
"Will people ever shut up about the upvotes. Its reddits algorithm.","pos"
"&gt;thinking I am actually mad","pos"
"https://www.reddit.com/r/soccer/comments/3r8200/leicester_are_the_only_premier_league_team_to/cwluhk4?context=3  https://www.reddit.com/r/soccer/comments/3jr07m/match_thread_san_marino_v_england_kick_off_1700/curkbxp?context=3  https://www.reddit.com/r/soccer/comments/3lkh11/leicester_citys_premier_league_form_since_april/cv6zgwe  lets all laugh at these idiots who doubted them","pos"
"Congratulations to Leicester. But one of the reasons they won its because all the big clubs had a shit season. It isn't a case of the best of the best.   If the next season they fail to reach top 4, it will be like Blackburn Rovers winning the league in 94","pos"
"Can a poor man get some free karma pls?","pos"
"Noice","pos"
"I'm still not going to believe it until that trophy is in Wes Morgan's hands","pos"
"Lads, it's spurs.","pos"
"All aboard the karma train!","pos"
"FIRST JON SNOW COMES BACK NOW LEICESTER WINS THE LEAGUE IS IT CHRISTMAS ","pos"
"HOLY SWEET BALLS THIS IS AMAZING","pos"
"So i plays for them in fifa 16 in be a pro. I feel proud now man. LETS GOOOOOOOOO","pos"
"Not many thought this would happen last year.","pos"
"I just don't... I can't... How?","pos"
"I love it that most kids who are about 4 today will be choosing Leicester to glory hunt!","pos"
"Just here to document I watched as Leicester city won the English premier league... amazing.","pos"
"LEICESTER! Wow.","pos"
"Definition of Determination, Spirit, Passion, The beautiful game. They didn't just win the premiere league, they won football. Mad respect to Leicester! ","pos"
