"final score today 6-1 barca  6 - 1 = 5  Falcons blew a 25 point lead in the superbowl","pos"
"What and how do you tell the score?  All I see is 6-1, and 6-5, so which is it?","pos"
"I just woke up, watched the GIF, and thought to myself...  WTF? They're up 5-1, in extra time, and not only are they trying to still score another goal but they're celebrating like crazy? Serious lack of sportsmanship...   Then I went back and saw 5-5 and now I get it.  I really get it.   I'm a Toronto Maple Leafs fan.   http://nesn.com/playlist/toronto-maple-leafs-five-biggest-collapses/1/  As the 8th seed a few years ago facing the #1 seed in the playoffs and a bitter rival in the Boston Bruins, we're in game 7 with 15 minutes left, up 4-1, and they come back, tie it, and then win it in overtime somehow someway.   Unbeliefable.","pos"
"[deleted]","pos"
"I don't even like football anymore","pos"
"1 wrong penalty and 1 questionable, how is this the greatest game you have watched?","neg"
"you mean the greatest suarez dive?","neg"
"Never gonna forget that","pos"
"Nah you can't be telling me that PSG didn't get robbed I have nothing against Barca and they were exceptional but Barca got some really soft calls in their favor and PSG deserved a penalty and the penalty call that Neymar got when Meunier slipped into him was defo not a penalty. ","pos"
"FULL CREDIT TO BARCELONA NO DOUBT, GREAT COMEBACK. But those penalties....","pos"
"I cannot believe what i've just seen. Amazing.","pos"
"I don't like Barcelona but  that is some impressive fucking shit. BRA-FUCKING-VO. ","pos"
"S/o to the sad cunt(s) down voting everyone in this thread","pos"
"GREATEST DIVERS EVAR","pos"
"As much as I hate the fact the game turned on Saurez's dive - and not even a very good one - it was really interesting how Neymar really stepped up in those last 15 minutes. He was the best player on the pitch by a mile, and it was interesting the Barca players seemed to turn to him to do something, rather than Messi.  Still a sickener that Saurez wasn't sent off for that second dive. That would have been interesting.","pos"
"Hahaha fuck you Di Maria!!!","pos"
"You have to admit that those penalties are arguable. But well played Barcelona","pos"
"To /r/all PSG basically did what the Falcons did at the superbowl. They blew the lead and Barcelona won 6-5 from being 4-0 down in the first leg (series) of the game.","pos"
"Can someone explain what happened? I was eating lunch in the cafeteria and suddenly 30 people watching the game just started screaming and yelling and falling to the ground. I didn't even realize it was on..","pos"
"Just leaving a comment here but I don't have anything to say.","pos"
"Holy fucking shit. This is football at its finest. Credit Bara. Credit PSG. Greatest match in football history? Name a better one","pos"
"Ochoa is so shit lol","neg"
"His positioning was wank, mate.","neg"
"Eh, I don't like Ochoa but to be honest  that was  an incredible shot","pos"
"Not as good as when we won in Columbus jajaja","neg"
"You're*","pos"
"So many Americans not supporting their local team   Embarrassing.","neg"
"Suprisingly, those teams end up being Barcelona, Bayern or Arsenal rather than Crawley Town, FC Gueugnon or Chacarita Juniors","neg"
"Yes we should all root for some small town teams in a country we've never been to because that's the noble thing... those big teams have way more brand exposure and are actually broadcasted internationally.","neg"
"yeah bet the connection from a new yorker to manchester united is big. ","pos"
"First contribution he's made in 5 years lmao what a goal","neg"
"US soccer=GOAT. Brazil distant #2.","neg"
"IN THE FUCKING ESTADIO AZTECA  (the altitude increases the degree of difficulty for that chip)","pos"
"Holy fuck it had to be him ","neg"
"Even the wall couldn't have stopped that! ","neg"
"Bradley with the covfefe chip!","pos"
"FAILING R/SOCCER CRITICIZING BRADLEY FAKE NEWS SAD","pos"
"USA&gt; Mexico.  Fuck Donald trump ","neg"
"Holy fuck...","pos"
"HOLY SHIT. GET FUCKED MEXICO! ","pos"
"You were saying?","pos"
"We can brag about a tie.   You, on the other hand, have to search for answers about how you couldn't defend your home turf at the ""mighty"" Azteca. ","neg"
"A draw is like kissing your sister, but this draw was like kissing your really hot step sister","pos"
"So butthurt. Throw any piss bottles at some Americans today?","neg"
"It's a draw, no need for that amount of salt bro.","pos"
"Nope. You'd be wrong. I just felt it was instant karma for those two hard elbows in the minute before the goal. ","pos"
"And the diving.  And the complaining to the referees.  And the other diving.  And the headbutting.  And the rest of the diving.  And more complaining.","neg"
"DID THEY PAY FOR IT?","pos"
"and get tired of winning?","pos"
"BIGLY","pos"
"WINE AND DINE ME FIRST U BISH","pos"
"USA USA USA USA","neg"
"Enjoy the mediocrity of arsenal","pos"
"Guzan is shit. It doesnt matter when you read this. ","pos"
"Hi,  I'm born in _____(put Latin America country name here) and I'm cheering the US and jumping in my house with this goal","pos"
"FUCK OFF MEXICO","pos"
"Even a wall couldn't stop that!","pos"
"OH MY FUCKING GOD","pos"
"Michael Bradley, you beautiful, beautiful man.","pos"
"US team better than Brits round 2 lol","pos"
"One day, but not any time soon, or in our lifetimes. ","pos"
"Do people really detect sarcasm this bad?","neg"
"are you actually mad","pos"
"Oh look Michael Bradley did something for the American team!","pos"
"Holy shit... Bradley did something... Something good too","pos"
"Ahhahahahahahahahhahahah","pos"
"This guy has built-in Newtonian physics calculator in his brain.","pos"
"R/soccer on suicide watch","pos"
"BUILD A WALL","pos"
"U-SA-! U-S-A!","pos"
"TO THE TOP OF R/ALL USA MOTHERFUCKER","pos"
"Im actually a pretty big Chicago Fire supporter but my dad and older brothers are all Arsenal fans so it was kinda handed down","pos"
"Before I moved to Atlanta the closet team to where I lived was 5.5 hours and 3 states away. (Before atlanta's team this year, the closest MLS team was 8 hours away).","pos"
"Liberals: WTF I hate Michael Bradley now","pos"
"GET FUCKED, CUNTS","pos"
"Why can't England do something like this, just once.","pos"
"God damnit Americans, just stop upvoting stuff just because it's an American scoring. Being chauvinistic is *not* a quality.","pos"
"Well yeah, still there are tons of pretty great goal posted on the sub and none hits 22k upvotes.","pos"
"That's really bad faith. That post is already ranking 11th highest voted post of all time on this sub, after only 6 hours. Not sure what else you need here.","pos"
"*disgruntledly closes Excel*","pos"
"Did the announcer yell GOAT ASSHOLE after?","pos"
"BUILD THE WALL","pos"
"GOAT~","pos"
"Wat.","pos"
"What the fuck Bradley","pos"
"Mxico again been shit","pos"
"Still in shock. What a fucking goal. ","pos"
"Lebradley","pos"
"still wank","pos"
"Its 1-1 now","pos"
"Whaaaaat! What a screamer! But still don't let this distract you from the fact that he's been performing poorly for quite some time now.","pos"
"Great goal indeed, but Bradley... its all about consistency common mang.","pos"
"goal of the century!","pos"
"Probably one of the best ""Get fucked Mexico"" shots by an American of all time...","pos"
"This goal is better than all the premier league goals this season.","pos"
"Any time a US or Canadian team heads to Central America the refs are abysmal.  The home team gets to play prison rules, away team can barely sneeze near an opposing player.  It's called getting concacafed.  In all seriousness, the ref in this game was decent by CONCACAF standards.  He'd at least call some fouls against Mexico, even if he'd never card them.","pos"
"Nope. I do feel like it is most soccer though. A game of who can draw the most fouls for the free kick advantage...","neg"
"Karma is a bitch","pos"
"What exactly did Guzan do? I saw Chicharito go down pretty easy and flop like a fish for a couple minutes. Is that the incident your speaking of?","pos"
"What, jumped vertically and not into Chicharito with an elbow like Salcedo? And after the ball was away? Keep on grasping at straws. ","pos"
"&gt; I'm just saying I thought it was a foul. I mean he did put his leg out even when the ball was out of play. I just thought it was intentional but hey, state your opinion and get downvoted for no reason.  The ""reason"" is that you're whining about being downvoted because of US bias when the fact is that you're being downvoted because you're pretty objectively wrong.","pos"
"WHAT AN AWESOME SOCCERBALL GOAL!","pos"
" http://i.imgur.com/1J6ScB2.jpg ","pos"
"American Outlaw fans look like they voted for Trump, racist fucks! ","pos"
"HE IS ONLY PLAYING BECAUSE HE WAS THE COACH'S SON THEY SAID!","pos"
"HOLY SHIT!","pos"
"Where the fuck did that come from?!","pos"
"inb4 Goal of the Year","pos"
"usa won fifa","pos"
"GOOD MORNING EUROPE","pos"
"THE BALD BEAUTY","pos"
"OMG he did something amazing for once...","pos"
"I was busy ranting via text about what i thought was a horrendous starting XI with my friend and this happened in the middle of it. Go figure.","pos"
"Holy fuck","pos"
"ME GUSTA","pos"
"Where my Bradley apologists at?? Tonight we ride!!","pos"
"What a goal from Bob Bradley!","pos"
"I don't wanna overreact or anything but that might have been the greatest goal I've ever seen","pos"
"midget ass goalkeeper","pos"
"/r/all","pos"
"get fucked tbh","pos"
"And all the times I've talked shit about him....","pos"
"My dad and I screamed so loudly we startled the dog. What a moment","pos"
"I guess he heard we were talking shit.","pos"
"Michael Bradley stock is at an all time high right now @ $1 a share ","pos"
"Good goal, but not the goal of the year.   https://www.youtube.com/watch?v=VsE5lJh-s5E  Never forget.   https://www.youtube.com/watch?v=GY6mdPbbxkY  and then this beauty by Castro.   https://www.youtube.com/watch?v=WOVUs08a5HY  Peraltas Zlatan style. ","pos"
"Every Hispanic channel like Telemundo and Univision goes ""El Tri"" this and ""El Tri"" that, like Mexico's some kind of awesome team, but there's no better proof of how much they stink when they get owned by a lesser known (not a bad one, but not as famous or recognized) player so easily","pos"
"Your team should hit the target more.","pos"
"Both teams hit the post. Tequila causes amnesia.","pos"
"""here we go, typical americans will upvote any sort of american go...""  ""oh""","pos"
"I dont understand why your comment is being downvoted ","pos"
"Make the brits angry in the morning ","pos"
"Two elbows in the face and we still score!","pos"
"Now Mexico is wishing there was a wall","pos"
"Hello /r/all.   Love. ","pos"
"Don't mind the downvotes. This is probably the first game americans have ever watched of football so they think a long ranged goal has never been done before. ","pos"
"Should have elbowed Bradley in the face instead, Mexico!","pos"
"/r/soccer must be conflicted about this one","pos"
"GO  LA  ZO","pos"
"To those who say that was cheap: fuck you, so was the elbow in the 3rd minute that should have been red.","pos"
"put some respeck on his name","pos"
"And Mexico should be down to 10 men. ","pos"
"Defenders are on Amateur mode.  """"""""""Becoz bradley played good""""""""""","pos"
"I'm joking dude. These are pro players. No disrespect. But I just remembered how you can run past the defenders in FIFA game with Amateur/easy settings the way Bradley did.","pos"
"6th minute. Against Mexico. In Stadio Azteca. Bradley truly is Captain America.","pos"
"NICE TO MEET YOU","pos"
"Captain America.","pos"
"I expect politics-free discussions to come of this. ","pos"
"This is honestly /r/all worthy. Amazing goal. ","pos"
"Karma farmer over here ","pos"
"Honest question....Do these actually make r/all or is it just a karma grab?","pos"
"American goal almost always make it to r/all ","pos"
"500 upvotes in 2 minutes. This is well on its way to the top of r/all","pos"
"its at 1","pos"
"Fuck you /r/all","pos"
"It is known","pos"
"It's treason then.","pos"
"Oh just wait until pulisic scores ","pos"
"Imagine if this one had been him","pos"
"I don't think I could handle an erection that big.","pos"
"I don't think the internet can handle that","pos"
"Dos a Uno with Pulisic.... still nice ","pos"
"That's not a back pass...","pos"
"well i guess it's better than a goal *for* Mexico... but really, he's responsible for setting up enough opponent goals that this doesn't win my support. sorry not sorry. ","pos"
"Holy FUCK what a goal","pos"
"Well, holy fuck","pos"
"That's a goal... Not what pulisic did last game","pos"
"WHAT IN THE MOTHER FUCK","pos"
"It's the Pulisic effect m8. You r/all lot wouldn't understand","neg"
"The team is certainly at a high point right now. There's nowhere to go but up.","pos"
"They're improving lately, and we have one of the best 18 year olds playing today on our squad. It's a good time to become a fan, we seem to have a good future ahead. ","pos"
"The US is definitely going to improve. Our U20 team made it to the Quarter finals in the U20 World Cup, 2 of those players are in the Premier League, and one is in the Scottish league.","pos"
"I think /r/all needs to understand more context to this goal. USA vs Mexico is one of the most heated rivalries in world soccer, especially with today's political climate. Michael Bradley hushed about a little under 100,000 Mexican fans. The reaction from the Mexican fans for me was just as priceless as the goal. ","pos"
"Honestly how the fuck do you get that much power on the ball AND be that accurate?  Unreal.","pos"
"# BRDLEY ","pos"
"Holy shit those elbows pissed me off ","pos"
"Can you guys see all the Bradley haters moving to the back? Lol","pos"
"I still hate him. All this time he's been proving me right and one good shot sends it all out the window! Now all my friends are giving me shit for it though lmao ","pos"
"One amazing shot doesn't make up for years of awful play.","pos"
"As if a million voices cried out and were suddenly silenced","pos"
"[deleted]","neg"
"I don't follow pro soccer...why does everyone hate this guy?","pos"
"Before WC2014: He was fantastic.  Post WC2014: WTF happened to yo","pos"
"Almost like playing alongside and against better players makes you better","pos"
"*cough* Jurgen *cough*","pos"
"Every professional coach/player/manager seems to rate him really highly, so I'm really not sure. Our possession flows though him, so he rarely makes highlight reels unless he makes a mistake.   Basically, the circle-jerk picked up enough steam that it's just confirmation/highlight biasing itself along at this point.","pos"
"A motherfucking heat check in Azteca. This is what dreams are made of.","pos"
"Off to delete my comments about Bradley on the Tobago thread","pos"
"Golazo. (Mexico fan)","pos"
"[removed]","pos"
"[removed]","pos"
"[removed]","pos"
"I for one have been a long time Bradley hater.  Score a goal like that? I'll sit down and shut the hell up.  LLLLLLLETS GO","pos"
"Wtf I love bradly now","pos"
"honestly he probably thought that was his goal and he was passing it backward","pos"
"BRADLEY&gt;MESSI","pos"
"World Cup is basically ours","pos"
"CR7*MESSI+Zidane=BRADLEY","pos"
"This is the dankest timeline","pos"
"Pulisic is shit","pos"
"REEEEEEEEEEEEEEEEEEEEEEEEEEEEEEEEEEEEEEAM","pos"
"He's been our best player for years, I'll never understand the people who attack him.","neg"
"Who else? Pulisic is better now, but there hasn't been a player of whom more was expected than Bradley. At least since Donovan took his break. Klinsmann spent basically his entire tenure constructing midfields around Bradley's passing ability.","pos"
"Quick do Guzan next!","pos"
"Not necessary, we all know already.","pos"
"I could say that also, but I'd be lying.","pos"
"#BradleyIn","pos"
"Bradley is his daddy too.","pos"
"/r/AtlantaHawks shoutout!  We love our daddies","pos"
"FIST ME ~~DADDY~~ BRADLEY","pos"
"SHAVE MY ASS DADDY BRADLEY ","pos"
"CHOKE ME DADLEY!","pos"
"I take back every bad thing i said about Bradley ","pos"
"I don't, but let it be known I have at least considered it.","pos"
"[deleted]","pos"
"Yeah should've been sent off after the second time. I never said the elbow was not a red/yellow.","pos"
"Captain America","pos"
"The perfect LB+B","pos"
"I was waiting for someone to say something like this. ","pos"
"I don't understand how people upload this so quick","pos"
"they watch it online and make a clip of it","pos"
"No one cares. Phil kessel is a 2 time stanley cup champion","pos"
"Finally, one in English.","pos"
"The Spanish announcer had so much better voice and delivered a much better call in the moment. Golazo is a great word. But the follow up commentary in English was good.","pos"
"Whatever motivates the lad","pos"
"Freedom strike","pos"
"Nope, Pulisic is making him look good, a player he thought about not even choosing. ","pos"
"Ochoa has been playing up like that the last few games... US did a great watching video and taking advantage","pos"
"Well it's about time he showed us. ","pos"
"i feel so gross upvoting this","pos"
"Green Buckeye?","pos"
"It's pretty much how they used to do their penalty shootouts.  No wonder he scored.","neg"
"Defensive about their disgrace of a league.","pos"
"But it still is overrated","pos"
"Lol that's what happened with pulisics goal. This goal is 1000 times better ","pos"
"Heard r/soccer was talking shit","pos"
"Out of the loop- can you explain?","pos"
"who are you kidding. he gets shit on in r/mls too and rightly so","pos"
"3 goals in a week ","pos"
"Goddamnit ","pos"
"That's a strange looking back pass. ","pos"
"Holy fuck ","pos"
"Yeah, you can see that he put backspin on the ball to get it to drop like that. Totally intentional.","pos"
"#BIG BALLS BRADLEY","pos"
"#MORE APPROPRIATE BBB THAN THE BALL FAMILY","pos"
"Damn I thought i could get away from Lavar in fucking /r/soccer","pos"
"Messi couldn't score two goals on LaVar","pos"
"""Shut up /r/soccer"" - Michael Bradley ","pos"
"Was that better than the Toivonen goal for Sweden over France?  That won the game, this one may shape it or give the US some swagger...","pos"
"Lloris was out of his net.  One touch yes, but no one to contend it.  Bradley's strike was much more ballsy. ","pos"
"Not even close, imo. That was a masterpiece.","pos"
"Factors in Toivonen's favor:  * Goal was from significantly farther out.  * 93rd minute by a player who played all 93 minutes.  * Game-winning goal.  * France is slightly better than Mexico, especially with some of Mexico's players already on their way to the Confederations Cup.  Factors in Bradley's favor:  * Opposing goalkeeper Ochoa was in a much better position than Lloris.  * The altitude at Estadio Azteca (7200 ft/2200 m) makes it harder to get the ball over the keeper and back down.  * Somewhat harder to steal the ball in Bradley's case, whereas Lloris nearly passed it to Toivonen.","pos"
"Talk about mountains out of mole hills.","pos"
"""Slightly better than Mexico""","pos"
"a decade ago with Domenech still on duty? Yeah, everyone won against that.","pos"
"Time will tell, bootfall.  Time will tell.","pos"
"I thought for sure this would be NSFW","pos"
"Exact same reaction","neg"
"Fuck off!  I upvoted for stealing that pass.  The power chip goal was pretty sweet too.  Cheers!","pos"
"I'm Mexican and same reaction. Also, You'll Never Walk Alone brother.","pos"
"Mkhitaryan esque","neg"
"Bar down and offside. I'll take Giroud's","pos"
"A lot better. He didn't flick or glance the ball on. He fucking full-on volleyed it with his heel. Wow!","pos"
"Are you a Man Utd fan by any chance? :D","pos"
"mkhitaryan didn't glance or flick it either.","pos"
"And he started the move!","pos"
"He was onside as well","pos"
"Eh, I don't see how it's better. On par for sure.","pos"
"[deleted]","neg"
"'Average' strikers don't score those","neg"
"Apparently they do ","pos"
"Tim Cahill was far from being an average player ","pos"
"You take that back. Big Timmy is an Australian legend. ","pos"
"I think you are confusing skill with luck. No doubt that these are monster goals, but these are flicks, done in hopeful desperation and gut reaction praying of getting a good redirect on it. Sometimes players just ""feel it"" and get a great tap of them and send them to just the right place at the right time, which this obviously was because he did it so far out and it knicked the crossbar. This goal is more of a testament to Giroud's instinct than his actual skill. Not to take anything away from this goal, but this took more luck than skill. Giroud is a good striker, but this isn't anything outside the ability of most strikers. It just takes a really good redirect and the gumption of trying something that will result in a loss of possession 99.9% of the time.  ","pos"
"Maybe if you're a child, that is a fucking beautiful goal.","pos"
"I didn't realise so many Liverpool fans had such strong feelings about Mkhi. ","pos"
"This kind of goal only happens because of a bad pass.  Discuss.","neg"
"holy fuck i just spit out my drink lol. agree with you though","pos"
"Agreed. Goals like this happen out of luck and just hopeful desperation. Sure this does takes instinct and skill, but it wasnt Giroud's intention to kiss the crossbar with that flick. He was slinging his foot up trying to make something happen in the box. Give the guy 1000 chances to recreate that goal, and he couldn't. By that undeniable fact, it's a lucky goal. Still sweet, but incredibly lucky.   Idk, it could be that I'm biased, but seeing these types of goals don't impress me as much as something like this: https://streamable.com/0aqy8. How Messi wraps the ball around the outside of his foot at the 57 sec mark is more impressive to me than Giroud's scorpion kick. Idk if it was because I played myself so I know there is a huge luck factor with what Giroud did vs what individual talent actually looks like. I'm not trying to be a dick either. Just my humble opinion on the subject.     ","pos"
"Meh! See these every week these days","neg"
"Brilliant goal but i still think Mkhitaryan's goal was better.","neg"
"Like a young Mkhitaryan. High boot though surely ?","neg"
"Incredible, goal of the decade.   Hello *r/all*, we are coming","neg"
"This your first visit to r/soccer? ","pos"
"My favorite fucking player ladies and gents","neg"
"Because it's never been a huge part of our culture.","pos"
"You need to get out more often.","pos"
"fuck this gif. The goal is like barely 10 frames. Stop karma whoring and post a good gif. ","neg"
"10x better than Mkhitaryans one wtf","pos"
"100x. Better?","pos"
"This is going to be the most upvoted goal in /r/soccer history.","neg"
"This one is better coz its onside.","neg"
"Like a young mkhitaryan","neg"
"I'm surprised this sub name is soccer ","neg"
"Bingo. Ignore the downvotes. This was just a hopeful desperation and it paid off. It took instinct and Giroud has that. But give Giroud 1000s chances to recreate that and have him kiss the crossbar like that and he wouldn't be able to replicate it again. That means it was luck. It took some skill of course but every professional striker playing the game in every league on earth has the ability to do what Giroud just did. It's so hard that it will always be unintentional, because no one can actually ""mean to"" place a flick like that  routinely. 1/1000. Still awesome, but people need to realize that this goal is  a circus novelty rather than intention put on display. Just an amazingly impressive lucky shot in the end.    ","pos"
"Zlatan Giroud","pos"
"Best goal of 2017","pos"
"Zlatan Olivierovic","pos"
"Zlatanesque","pos"
"&gt; This is the greatest striker in football right now  Seriously?","pos"
"In football today? Nah, I'd say he's clearly overtaken Bendtner as the greatest of all time. ","pos"
"Lol wut","neg"
"They're not a proper club until they win the FA vase","pos"
"Ignore the downvotes. Seriously. These people don't have a clue what it takes to pull off a circus flick like this routinely, hence why Giroud (or anyone in history) don't have multiple goals doing shit like this. It was a lucky, instinctive flick. Give Giroud 1000 chances to replicate it (kissing the bar and everything) and he wouldn't be able to. Most of his chances wouldn't even make it to the goal, much less actually score on a goalkeeper. It's obvious this was luck. Does it take away from the ""awesomeness"" of it? No, not really. Cool ass circus flick. But does the luck factor take away from the ""impressiveness"" of it? Yes, absolutely.   I posted it here already but I'm more impressed at the 57 sec mark of this video of Messi than I am with Giroud's goal: https://streamable.com/0aqy8. One is a display of godlike skill with a simple tap of the outside foot and the other is a lucky flick that almost anyone can do (it's just that it only happens 1/1000 chances so it's awesome when it does. But awesome isn't the same as impressive. Giroud's was awesome, but it wasn't impressive, because that implies intention).   ","pos"
"The net. Just like Ozil's been doing a lot of this season","pos"
"Goal of the season no doubt","pos"
"Goal of the year for sure","pos"
"Sit the fuck down Mkhi ","neg"
"Holy fucking shit, who the fuck thought Mhkis goal would be bettered!? Incredible!","neg"
"Let's talk about ONSIDE","pos"
"It wasn't that amazing.. I've scored better on Sunday league. ","pos"
"Goal of the year so far ","pos"
"Goal of the year","pos"
"Goal of the season. Giroud, you beautiful French bastard.","pos"
"He was even onside!","pos"
"I think I have seen a fairly similar one very recently........ ","pos"
