"Miss a sitter , score goal of the season. Just giroud things.","pos"
"Better than Mkhitaryan's maybe?","pos"
"""Henrikh Mkhitaryan, eat your heart out""   Jon Champion is unreal","pos"
"I'll be honest, I much preferred Giroud's goal.","pos"
"Oi nah, after seeing that I'd allow Giroud to fuck every female family member I have and wouldnt get mad","pos"
"This happened at the start of the season too when Henderson did a cracker of a long shot only for Xhaka to do almost exactly the same shot the next day ","pos"
"Yup, that's not being beaten this season at least ","pos"
"He was literally looking at guiding it in the net and had no support, what doubt is there?","pos"
"Insane goal but not a scorpion. Scorpion is with your heel, Giroud used the outside of his boot.","pos"
"I LOVED SCORING LIKE THIS WHEN I WAS A KID   SHIEEEEEEEEET","pos"
"[removed]","pos"
"It's better than Mkhis already hahahaha","pos"
"hello r/all. happy new year!","pos"
"*sigh* typical Arsenal, just trying to do what Man Utd have already done. ","pos"
"Henrikh who?","pos"
"This is now officially the 2nd highest upvoted post in the history of r/Soccer. History made. ","pos"
"More difficult, not offsides, no defenders on you, and not in the last minute of a game.  Way better goal.","pos"
"You seem deluded.  Mkhis goal was the one with no one marking him, and last minute where United are already winning. No real pressure to score it.  Giroud was involved in the buildup from the start, ran from the halfway line, got delivered a pretty bad cross by sanchez, improvized with an acrobatic scorpion kick being right behind flamini trying to head it away and 2 defenders coming from his back.  I don't get how people can not accept this is an insane goal.   ","pos"
"Obviously...  =========  =========  =========  Sligo Rovers...","pos"
"Offside Arsenal with meme goal.  To the top!","pos"
"Sacre bleu!","pos"
"why this subreddit is called soccer and not football? Just wondering","pos"
"Handegg. Beautiful.","pos"
"yawn","pos"
"The guy has a fairly decent goal scoring record. Him scoring a scorpion kick is the weird (amazing) thing","pos"
"Woah man. You can't come around here bashing the most handsome man on the pitch. Take your Madrid flair, and fuck off. ","pos"
"GIROUD 2017!!! NEW YEAR SAME SEXY","pos"
"Olivier Giroud FC","pos"
"Pretty much the most flashy goal from the least flashy player in the Prem, insane goal!","pos"
"Goal of 2017.","pos"
"And it was onside unlike Mkhitaryan","pos"
"Top of all time we go  Arsenal player scoring a great goal. ","pos"
"Sanchez crossed like ""let me put it slightly behind you so you can make Mkhitarian look like an amateur""","pos"
"Poor mkhi thought he had goal of the season ","pos"
"Giroud was onside!","pos"
"That's goal of the year","pos"
"Goal of the year in January 1st. well done.","pos"
"Goal of the year!","pos"
"Henrikh just crushed his coke can in his mailed fist.","pos"
"Onside","pos"
"IT'S JANUARY 1ST  Goal of the Year wrapped up lads, go home.","pos"
"BEST GOAL OF THE YEAR","pos"
"Best goal of 2017 ","pos"
"Giroud is much easier to say than Mhiktaryan","pos"
"The referee knew about Giroud's and Flamini's friendship, and realised there was no malice in that slap-kick attempt. Something Zlatan should learn from.","pos"
"REPLAY - https://streamable.com/ylshz","pos"
"almost as good as Laurent Roberts effort back in the day. ","pos"
"WHAT THE FUCK IS MY BUTTHOLE","pos"
"Goal of 2017","pos"
"Give him Puskas Award already","pos"
"Only offside ones though","neg"
"Best goal this year, yet.","pos"
"Best goal of 2017","pos"
"That's even more Zlatan than Zlatan.","pos"
"He actually shot it on target /s","pos"
"Giroud broke reddit..","pos"
"First day of the year and already goal of the season.","pos"
"Misses sitter, scores belter. Oh giroud.","pos"
"Now that's what you call a skill ... Zlatan, Giroud, ... those guys are crazy with goals ... ","pos"
"i think he is more known for his tap ins","pos"
"Scorpion is with your heel, not holding the ball between your legs. Giroud's wasn't a scorpion either.","pos"
"He stole the Mkhitaryan's thunder. But well done Giroud, least expected guy to do so to be honest.","pos"
"Not even offside. ","pos"
"Henry has to cheat to score, meanwhile Giroud does shit like this.  Arsenal and France's best ever striker.","pos"
"He's in the god tier below along with Bendtner ","pos"
"Damn United fans, so bitter and sad.","pos"
"How the fuck","pos"
"What the fuck right now","pos"
"Gorgeous goal for a gorgeous man ","pos"
"Mkhitaryan has been giving out lessons it seems.","pos"
"Like a young miki","pos"
"2017 is already better than the whole of 2016.","pos"
"Palace fan here......if ya gotta get scored on...let it be sweeeeeeeeet.  One of the few goals you watch and you just smile.....still dropped an F-bomb, though.","pos"
"IbraGiroud !","pos"
"Congrats for reaching r/all/top/ (of the day, top 50) with your post! &amp;nbsp;  *****  *^I ^am ^a ^bot, ^probably ^quite ^annoying, ^I ^mean ^no ^harm ^though*  *^Message ^me ^to ^add ^your ^account ^or ^subreddit ^to ^my ^blacklist*","pos"
"At least this one was onside!","pos"
"2017 goal of the year wrap it up lads it's over. ","pos"
"The Goal of 2017!  Scored on the first day of 2017!","pos"
"You mustn't have been impressed by a goal in a long time then ","pos"
"I'm sure Giroud would be greatly disappointed to know that you're not impressed, nameless redditor.","pos"
"[deleted]","pos"
"#2017 Strikes Again! oh wait...","pos"
"Mkhi did it before it was cool.","pos"
"I gotta start watching the Prem","pos"
"No regard for human life","pos"
"One hell of a lucky goal, amazing nevertheless ","pos"
"lol","pos"
"Not even mad. That might be the best goal I've ever seen.","pos"
"This your first game?","pos"
"GIROUD YOU HANDSOME FUCK","pos"
"What makes it even worse is that this was better than Mkhi's and I thought that would get goal of the season. It's been a while since we had goal of the season. :( ","pos"
"[deleted]","pos"
"High kick, they said this allowed this goal. ","pos"
"Can Giroud please decide if he's a bad or a good striker. ","pos"
"[Orig+More Angles 720p](https://streamable.com/66fxg)","pos"
"[deleted]","pos"
"Over 1k upvotes in less than 5 minutes. Fully on for top of all time on this sub. ","pos"
"He's jealous of Mhky","pos"
"This goal was better and it wasnt offside ","pos"
"Except for the fact that this one is...you know an actual valid goal?","pos"
"I don't know. Seems like Zlatan is going at least try something tomorrow. ","pos"
"Hello r/all","pos"
"fuck you and your shitty karma grabbing comment","pos"
"Fuck /r/all","pos"
"Fuck the DH ","pos"
"Fuck the Yankees","pos"
"/r/all can suck a dick","pos"
"All r/all upvote is shitty NSFW gifs and trashy memes  Fuck r/all Indeed","pos"
"No goal should ever beat the Leicester thread, not even the bicycle kick by the goalkeeper in the dying seconds to tie the game.","pos"
"You get one too","pos"
"Salt.","pos"
"600 upvotes within 2 minutes, holy jesus ","pos"
"For those coming from r/all.  This goal is like LeBron James dunking using only his tongue.","pos"
"it's like living a successful life filled with love and adventure where every day is better than yesterday and you die peacefully surrounded by loved ones without a single regret and no moment you would change or do differently.","pos"
"No way, this is like Al Horford, center of Boston Celtic, to dunk using only his tongue.","pos"
"Did you just compare Giroud with LeBron James","pos"
"I love Giroud and all. He's a great athlete. But he is a big show off. For this reason I believe is why Wenger hasn't started him much this season.  Excellent goal though. ","pos"
"It's Arsenal, so, yes!","pos"
"if giroud had mkhi's pace he would have been offside xd","neg"
"Not onside though!","pos"
"Moral offisde. Nad I thought ironmongery would be the bet word i learned today","pos"
"Stupid sexy Giroud","pos"
"1. keeper should have done better 1. He'll never hit another one like that in a million year ","pos"
"and he was onside","pos"
"Wow. I thought Mhki's goal was going to be the best goal I see this week.","pos"
"Agreed. Anyone remember Messis crazy flick he scored in the  CL a couple years ago? Insane skir but didn't count so nobody cares.","neg"
"As I said, a great goal, but a lot of credit is taken away because the goal should've been disallowed. ","pos"
"As opposed to outside.","pos"
"Duh,  roof weren't on. ","pos"
"Recreated Mkhitaryan's goal on hard mode","pos"
"Goal of the year already.","pos"
"Mhiki's was goal of 2016, Girouds can be 2017's","pos"
"You're having a giraffe mate","pos"
"Stupid long horses","pos"
"Not a chance.  Definitely the Boateng goal.  ","pos"
"Well Mkhitaryan's wasn't a goal technically","neg"
"But in practice it was ","pos"
"It was more spectacular probably, but it was offside.  Two awesome goals, in the end.","pos"
"My bad","pos"
"I still think Mhiki's was better. Something about Giroud's just looked awkward and Mhiki's looked natural. ","pos"
"&gt; Giroud's just looked awkward and Mhiki's looked natural.  Probably something to do with being onside.","pos"
"I love how fucking glorious goals always bring fans together, regardless of bias. When the Southampton right back (I forget his name I blame many booze - apologies) scored that barnstormer against us to start the 4-0 I don't think any arsenal fan could have said anything less than ""got hold of it well, didn't he?"". Hell yeah football.","pos"
"the salt is so so sweet ","pos"
"Higuita been doing scorpion kicks since before anyone decided to make Mhkitaryans name completely unfathomable ","pos"
"Just shut up. Shut up.","pos"
"Surely not!","pos"
"[deleted]","neg"
"Goal of the century","neg"
"goal of the match","pos"
"This is honestly one of the best goals I've ever seen","pos"
"13 minutes and it's at the top of /r/all!","pos"
"you forgot beautiful in that description ","pos"
"Earlier in the game:  https://my.mixtape.moe/oixlhw.mp4  Classic Giroud.","pos"
"Idk, I kinda think he should score another one tbh.","pos"
"mate what the fuck was that","pos"
"","pos"
"Ayyyrsenal","neg"
"One of the best goals I've seen to be perfectly honest   And in perfect Giroud fashion was just after he missed a piss easy tap in","pos"
"[deleted]    ^^^^^^^^^^^^^^^^0.1967   &gt; [What is this?](https://pastebin.com/64GuVi2F/70439)","pos"
"Scores when he wants, even laying down.","pos"
"That's Giroud for you. He has just fucking missed a tap-in and scores that screamer","pos"
"""Because I'm perfect""","pos"
"As a United fan, I hate everything about this goal.","pos"
"Fastest thread to the top in r/soccer history? ","pos"
"Giroud can fuck my bitch.","pos"
"fuck shit what","pos"
"It's pretty standard Giroud, tbh.","pos"
"maybe this is the year when even i will get to score with a girl?","pos"
"Is he taking the Mkh","pos"
"[removed]","pos"
"**B R E X I T    B  R  E  X  I  T**  Lads, it's England","neg"
"Time for a story.  You may have seen the Nike 'Switch' advert with Cristiano Ronaldo. The eagle eyed among you may have realised that the Charlton Preston game was filmed at Rotherham's New York Stadium. I was a member of the crowd for that game, in fact they also filmed some of the other games there too. This included the England Portugal game.  In the advert you see Harry Kane score in that game and on the day they had, unsurprisingly, a Harry Kane look-a-like. Once everyone was in place the cameras roll. Ball comes to our hero/Cristiano Ronaldo who deftly knocks it to Kane who...skys it! The crowd respond with 'oohs' and hold their heads. To our surprise Kane and others were celebrating. Of course! The ball doesn't need to go in the back of the net, this isn't real life. After a breif telling off by the director we go again, same move and... Kane pulls it wide! We erupt, cheering jumping up and down, the whole works. Take three... Kane misses - the crowd goes wild. And again. And again. I don't know how many times we did this. I started feeling sorry for this guy. We'd got into crowd mindset and the pisstaking echoed around the all but empty stadium. Finally the director calls 'one last take' and we go again the touch to Kane, he shoots and the back of the net ripples! Fuck me he's actually scored! For the first time that day we genuinely cheer, strangers hugging one another, it was a beautiful thing.  Looking back now it makes wonder if it actually was a look-a-like, but it must have been. This guy actually managed to score.","neg"
"Game of Thrones Spoiler dude not cool!","pos"
"You know what? From an American perspective, England is comparable to Mexico. The Mexican press are always hyping Mexico up and comparing them to great teams like Brazil, Argentina and Chile but then when it comes to a major international tournament they go out quickly. This embarrassment reminds me of their loss to Chile 7-0 Copa America. Beat by the better team. ","neg"
"England is taking this BREXIT way too seriously, mates.","pos"
"I actually did. But so did other 4 thousand people, it seems. Thank you, I'll take your honest compliment.","pos"
"apologies for bad english  where were you when england got kicked out from Euro 2016?  i was at home eating lecs when roy rang  ""englend is exit""  ""no""","neg"
"**E**  **X**  **I** **T**","neg"
"[deleted]","neg"
"You're totally right fuck the downvotes I'm tired of the hate America circlejerk when their own national team can't get their shit together against Iceland.  And the worst part was that I was rooting for England ","neg"
"Learn to take the banter before you talk shit.","pos"
"Lads, it's Tottenham ","neg"
"*insert brexit joke*  OK guys, I'm ready for my first gold ","neg"
"Fuck off","pos"
"No England players turned up at all. Of course a gunners fan makes it about spurs though, when it isn't. I swear you're all more obsessed with us than you are with your own club.","neg"
"So maybe now England will stop acting like they're the best in the world and favorites to win any tournament they compete in?","neg"
"Those are my thoughts as well.","pos"
"They voted LEAVE again..","neg"
"UR GOING HOME LADS","neg"
"I am so utterly unsurprised by this result. In fact, the only thing that surprises me is that everyone else is so damn surprised.  Look at the players as individuals -- Rooney: past it. Wilshere: crocked all season. Kane: overrated. Alli/Rashford: too young to lead anything.   What the hell is everyone boohooing about? England isn't ""underperforming"". They are performing *exactly* to their level. Get the hell over it.","neg"
"England National teams are always a joke. ","neg"
"Hey england, if you want to stop being shit at soccer then unite your teams. Combine NI, Wales, Scotland, and England and you'll have a world class team instead of the shit you bring up each year.","neg"
"Can't even think of what could top it.  Vatican vs Germany, maybe.","neg"
"[deleted]","pos"
"Holy overreaction. Greece is way bigger than this.","pos"
"Actually that was Greece winning in 2004, but it's a close second.  ","pos"
"HAHAHAHA","pos"
"Are you saying to me that the most overrated league have the most overrated NT ?","pos"
"ANOTHER BREXIT, BOB LEY SAID IT","pos"
"England is the Mexico of Europe ","pos"
"This is the first time Ive seen a post hit 5 figure points I think","pos"
"[deleted]","pos"
"Holy shit. My mom came into my room to bring me a plate of chicken nuggets and I literally screamed at her and hit the plate of chicken nuggets out of her hand. She started yelling and swearing at me and I slammed the door on her. I'm so distressed right now I don't know what to do. I didn't mean to do that to my mom but I'm literally in shock from the results tonight. I feel like I'm going to explode. Why the fucking fuck did England lose? This can't be happening. I'm having a fucking breakdown. I don't want to believe the team isn't the best.. I want a future to believe in. I want England to be champions and fix this broken country. I cannot fucking deal with this right now. It wasn't supposed to be like this, I thought they were looking well in the odds against Iceland. This is so fucked.","pos"
"apology for poor english  when were you when england dies?  i was sat in the pub eating fish nd chips  england is kill  no","pos"
"Chat shit get banged.","pos"
"Yeah, dat boi is much better...  *FUUUUUUUUCK DUDE*  Ok, so I can't enjoy anything? I'm SOOO fucking sorry I enjoy it. Just for you. Just for you and anyone who agrees with you. Because I know it's a big fucking problem what memes I enjoy right?   I mean, it's not like the Internet has raped and ravaged my mind so I'm a whiny defeatist fuck who over analyzes everything, that's simply not enough, I also can't enjoy certain memes, because Chaydon Dick of the Internet thinks it's stupid.  No, you know what, **FUCK** you. Fuck all of you. One second you talk shit about this meme, than you go on to laugh at stupid shitty pun threads, dad jokes, and other limp wrist jokes made up by kiddies that listen to pink Floyd and are afraid of anything fuck you I love this meme I think it's funny the fact that you don't doesn't make you better, like your skinny fat self thought when you smugly looked at all the people that upvoted you it just makes you an annoying cunt who needs to be fucking shot.","pos"
"chill","pos"
"You must not know many memes","pos"
"Is this going to be reposted every time a team goes out? So fucking unoriginal","pos"
"Fuck this meme","pos"
"I think it's funny ","neg"
"4 u","neg"
"You seem angry...","pos"
"""X is kill"" and crying Jordan are both getting so stale. They jumped the shark. ","pos"
"Fucking basement dwellers. After a game like this and you come up with this nerdy shit comment? Imagine saying this stupid shit on a pub or with your mates watching the game. Bunch of fucking social awkward retarded basement-dwellers on here. ","pos"
"It's a nice meme IMO, no /s","pos"
"apology for poor england  when were you when england die?  it was 85 minute in game when woy says  'ok i sub now'  'no'","pos"
"how in the fuck did iceland win","pos"
"What do you say when something is so hilarious and classic that you cannot laugh?","pos"
"Ayy where them crying Jordans tho?","pos"
"this has brexit my heart ","pos"
"F","pos"
"AhHHHHHHHHHHHHHHHHHHHHHHHHHHHHHHHAAAAAAAAAAAAAAAAAAAAAAAAAAAHHHHHHHHHHHHHHHHHHHHHHHHHHHHHHHHHHHHHHHHHHHHHHHHHHHHHHHHAAAAAAAAAAAAAAAAAAAAAAAAAAAAAAAAAAAAAAAAAAAAAAAAAAAAAAAAAAAAAAAAAAAAAAAAAAAAAAAAAAAAAAAAAAAAAAAAAAAAAAAAAAAHAHHHHHHHHHHHHHHHHHHHHHHHHHHHHHHHHHHHHHHHHHHHHHHHHHHHHHHHHHHHHHHHHHHHHHHHHHHHHHHAAAAAAAAAAAAAAAAAAAAAAAAAAAAAAAAAAAAAAAAAAAAAAAAAAAAAAAAAAAAAAAAAAAAAAAAAAAAAAAAAAAAAAAAAAAAAAAAAAAAAAAAAAAAAAAAAAAAAAAAAAAAAAAAAAAAAAAHHHHHHHHHHHHHHHHHHHHHHHHHHHHHHHHHHHHHHHHHHHHHAhHHHHHHHHHHHHHHHHHHHHHHHHHHHHHHHAAAAAAAAAAAAAAAAAAAAAAAAAAAHHHHHHHHHHHHHHHHHHHHHHHHHHHHHHHHHHHHHHHHHHHHHHHHHHHHHHHHAAAAAAAAAAAAAAAAAAAAAAAAAAAAAAAAAAAAAAAAAAAAAAAAAAAAAAAAAAAAAAAAAAAAAAAAAAAAAAAAAAAAAAAAAAAAAAAAAAAAAAAAAAAHAHHHHHHHHHHHHHHHHHHHHHHHHHHHHHHHHHHHHHHHHHHHHHHHHHHHHHHHHHHHHHHHHHHHHHHHHHHHHHHAAAAAAAAAAAAAAAAAAAAAAAAAAAAAAAAAAAAAAAAAAAAAAAAAAAAAAAAAAAAAAAAAAAAAAAAAAAAAAAAAAAAAAAAAAAAAAAAAAAAAAAAAAAAAAAAAAAAAAAAAAAAAAAAAAAAAAAHHHHHHHHHHHHHHHHHHHHHHHHHHHHHHHHHHHHHHHHHHHHH","neg"
"It's the second brexit of the week.... ","neg"
"Absolute embarrassment to the nation.  Every single one of them should be lined up against a wall outside Buckingham Palace and be shot by the Grenadier Guards.  Televise it live on TV, invite the public down and bring the popcorn and the kids out and make a day of it.","pos"
"116 123  Let's try talking to someone first, shall we?","pos"
"[deleted]","pos"
"As a proud Welshman - FUCK OFF ENGLAND, FUCK OFF ENGLAND, FUCK OFF ENGLAND!!!!","pos"
"Are you saying to me that the most overrated league have the most overrated NT ?","pos"
"Hello /r/all, what you're witnessing here is the equivalent of the Emus kicking the asses of the australian military. It's your small hometown basketball team destroying one NBA team after another. It's a country with a grand total of 70 pro football players beating the hometown of football out of a major tournament. It's beautiful.","pos"
"I like how the only player you have an excuse for is Sturridge. ","pos"
"https://gfycat.com/NippyKindLangur","pos"
"How you leave Europe twice in a week?","pos"
"Before this I disliked Joe Hart. Now I hate him","pos"
"BREXIT","pos"
"Hodgson stareted Kane, Alli and Sterling again when they've been the most toothless combination in this campaign.   Inexcusable, Roy gone and those 3 need a long fucking time to redeem themselves for England again.","pos"
"    B A N T E R          A         E          N         T          T         N          E         A          R E T N A B","pos"
"It actually fucking hurts me on an emotional level that this joke has been made over 3949435943 times and is still being upvoted. The smug look I imagine you have on your face seeing this upvoted thinking to yourself ""man i'm clever"" annoys me more than England leaving the tournament. ","neg"
"Brexit jokes Pt. 12029372829849202839","pos"
"England voted Exit","pos"
"Roy Hodgson is a Good Manager and the amount of abuse he is getting tonight is disgusting. Maybe blame the uninterested players instead, it was not Roy's fault.","pos"
"[deleted]","pos"
"[Can someone make this in a way it doesn't look like shit?](http://imgur.com/EOJU7Ms)","pos"
"Things I learned thanks to Iceland beating England :   - The Vikings actually reached Iceland   - ~~England is Inglaterra in Icelandic (learned this one from twitter because it's trending thanks to Icelandics.)~~ Which is exactly how ""England"" is pronounced in Arabic  - Iceland has a population of only 330 000 people, I thought it's way more.  - Iceland has only 76 professional players  - 98% of Iceland's professional players' names end with sson, ssen, son.  - Iceland is the only country in the world where the president (lfur Jnsson) is a semi professional footballer","pos"
"Oh my days, this is bloody fuckin Karma lad.    Your country leaves the Union and then Iceland takes the tip of the iceberg and shoves it straight up your ass England.  Now you know how the folks in Scotland feel.","pos"
"[deleted]","pos"
"  Kane, Rooney, Walker, Sterling and Hart were all utter shit. We don't need an entire thread with 500 : _______ IS SO FUCKING SHIT comments.","pos"
"England knocked out of Europe twice in a week.","pos"
"""Looks like England left Europe twice in a week"" - My friend","pos"
"Rooney was England's best player in the first half. Dreadful second half and thankfully he came off, but it's crazy how everyone here lynches the man and easily forgets he totally controlled the tempo and movement of the ball for the first 45. The only thing missing from this whining post is the ridiculous cherry-picked stats about incompleted passes and pass completion BS.","pos"
"Reddit is so fucking gay","pos"
"[deleted]","pos"
"Scotland have moved to Iceland  https://www.reddit.com/r/Iceland/comments/4q5lx6/j/","pos"
"Literally no one thinks that. We take the piss out of ourselves plenty. I'm amused at how one sided this rivalry is. You lot can't even qualify for the euros. Enjoy supporting hibs","pos"
"","pos"
"I'm not sure why we expect a team of mostly Spurs players not to bottle it...","pos"
"And Wilshere","neg"
"I agree except wilshere was the best player when he came on","pos"
"Yeah, with the way Belgium are bottling it?  Fuck off with this opportunistic logic. ENGLAND was poor.","neg"
"Belgium are an entire team like England. Nobody is like ""lolBegium so Spursy"" because Belgium field 2-3 Spurs players and had a shit match against Italy. ","pos"
"Me: Belgium are an entire team like England. Nobody breaks them down into individual players when they fail.   You: England is mostly Spurs players.","pos"
"Yeah it's Spurs fault England has failed since 1966","pos"
"Alli does meh in his first tournament. ""Just retire bro""","pos"
"I was talking the tournament in a whole not just this game. ","pos"
"That didn't take long. Of course it's Spurs fault, who else.","pos"
"&gt; England beat Wales: IT'S COMING HOME, LADS &gt; &gt; England draw Russia, knocked out by Iceland: lol so spursy.  Lot of Arsenal flairs taking glee in that. I shouldn't be surprised.","pos"
"Hahahah spurs brigade downvoting you  Fuck off spurs, shit team that breeds shit players with shit mentality ","neg"
"Shhhh, don't interrupt the circlejerk.","neg"
"Wilshere was shit too, Its ironic his misplaced passes shown on tv currently while I was typing xD","neg"
"I can't tell if you're being serious but yes it is always cheering for them. Largely because they're the largest fan base here by over 50% of the next highest team (Chelsea, who also hate us)","neg"
"Except Arsenal and Chelsea have 250% the fans we do on this subreddit not to mention being 1&amp;4 in total numbers. So yeah our rivals are loved here.","pos"
"[deleted]","pos"
"I'm sure England would've done muchhhh better with Giroud in the team today /s","pos"
"[deleted]","neg"
"Well when 5/14 players come from Spurs it's hard not to blame them... Especially when one of them is supposedly a great free kick taker but can't pass a ball 5 yards...","pos"
"Yep, Walker was fantastic at allowing Iceland to equalise.","neg"
"what game were you watching? None of those players were ""fantastic"" and Walker had an awful game.","pos"
"I think i watch a different sturridge. The guy's that clumsy he can hardly control a ball. One good cross does not make a performance.","pos"
"5 out of the 11 were Spurs players, and each of them were shit.","pos"
"even though i'm livid that was mint","pos"
